id,hidden,angellist_url,product_desc,screenshots,logo_url,company_url,video_url,company_size,facebook_url,locations,quality,linkedin_url,name,updated_at,community_profile,company_type,markets,twitter_url,crunchbase_url,follower_count,created_at,blog_url,status,thumb_url,high_concept,abilities
884837,False,https://angel.co/enova-2,"Enova is an online financial services provider driven by technology and analytics. Since its founding in 2004, Enova has provided online loans to more than three million people on five continents. We’re proud of our global business model, which is driven by a smart and motivated workforce and a dedication to customer satisfaction.",[],https://d1qb2nb5cznatu.cloudfront.net/startups/i/884837-1f91f0636dc3d93e7c35e5fced0e4e26-medium_jpg.jpg?buster=1445458342,http://www.enova.com,,501-1000,,"[{'id': 1626, 'angellist_url': 'https://angel.co/chicago', 'display_name': 'Chicago', 'name': 'chicago', 'tag_type': 'LocationTag'}]",1,,Enova,2015-10-30T18:55:02Z,False,[],"[{'id': 29, 'angellist_url': 'https://angel.co/e-commerce', 'display_name': 'E-Commerce', 'name': 'e-commerce', 'tag_type': 'MarketTag'}]",,,1,2015-10-21T20:12:27Z,,,https://d1qb2nb5cznatu.cloudfront.net/startups/i/884837-1f91f0636dc3d93e7c35e5fced0e4e26-thumb_jpg.jpg?buster=1445458342,Closing the worlds credit gap,"{'intro': {'has': False, 'can': False}}"
888207,False,https://angel.co/equip-me,"Equip' ME! is an online platform where people can share their own equipment with others to rent. Post your extra equipment share it with your neighbor, make a little extra on equipment you barely use. Or rent that equipment you need for that event or project you have always wnated to do but never had the resources to buy or do before.  Customers; male and female, 18 to 50, 15k or greater, tourists (local and international), Universities and their student organizations.",[],https://d1qb2nb5cznatu.cloudfront.net/startups/i/888207-86301b2af74be4bb314eaaa2092002e7-medium_jpg.jpg?buster=1445732779,http://www.equipme.io,,1-10,http://www.facebook.com/equipme.io,"[{'id': 1693, 'angellist_url': 'https://angel.co/san-jose', 'display_name': 'San Jose', 'name': 'san jose', 'tag_type': 'LocationTag'}]",4,,Equip' ME!,2015-10-26T03:41:53Z,False,"[{'id': 144398, 'angellist_url': 'https://angel.co/peer-to-peer-sharing-search-engine', 'display_name': 'Peer To Peer Sharing Search Engine', 'name': 'peer-to-peer sharing search engine', 'tag_type': 'CompanyTypeTag'}, {'id': 144399, 'angellist_url': 'https://angel.co/sharing-economy-aggregator', 'display_name': 'Sharing Economy Aggregator', 'name': 'Sharing Economy aggregator', 'tag_type': 'CompanyTypeTag'}, {'id': 149436, 'angellist_url': 'https://angel.co/peer-to-peer-lending-platform', 'display_name': 'Peer To Peer Lending Platform', 'name': 'peer-to-peer lending platform', 'tag_type': 'CompanyTypeTag'}]","[{'id': 134, 'angellist_url': 'https://angel.co/peer-to-peer', 'display_name': 'Peer-to-Peer', 'name': 'peer-to-peer', 'tag_type': 'MarketTag'}, {'id': 772, 'angellist_url': 'https://angel.co/outdoors', 'display_name': 'Outdoors', 'name': 'outdoors', 'tag_type': 'MarketTag'}, {'id': 13081, 'angellist_url': 'https://angel.co/online-rental', 'display_name': 'Online Rental', 'name': 'online rental', 'tag_type': 'MarketTag'}, {'id': 151860, 'angellist_url': 'https://angel.co/sharing-economy-4', 'display_name': 'Sharing Economy', 'name': 'sharing economy', 'tag_type': 'MarketTag'}]",https://twitter.com/EquipME_US,,3,2015-10-25T00:26:24Z,,,https://d1qb2nb5cznatu.cloudfront.net/startups/i/888207-86301b2af74be4bb314eaaa2092002e7-thumb_jpg.jpg?buster=1445732779,Peer-to-peer rental of equipment,"{'intro': {'has': False, 'can': False}}"
884489,False,https://angel.co/etutor-school,"eTutor School is a pre-revenue stage language learning website where students connect with tutors though our scheduling system platform. The website is unique as it is very interactive and it promotes maximum exposure to language learning. We have the following features that some other language learning websites don't have:

- Clean and sharp appearance of the interface 
- Scheduling system
- Group chat room in the main dashboard and in other pages of the website (third party chat room)
- Filters for finding tutors and students (ease of use)
- Question and Answer Hub where students and tutors can post for free
- Blog page
- Google adsense can also easily be installed for maximum profit potential.

eTutor School helps bridge the gap between students and tutors from all over the world. We have a very active language learning group on facebook and an active facebook page as well.","[{'thumb': 'https://d2gn4xht817m0g.cloudfront.net/p/product_screenshots/images/thumb/000/605/304/605304-d16baa7da46e8accd0d99cd21acb3a0efe357c2d.jpg?1445445546', 'original': 'https://d2gn4xht817m0g.cloudfront.net/p/product_screenshots/images/original/000/605/304/605304-d3bebf5a47a2cd689b7bc2115d250305d8ea6555.jpg?1445445546'}, {'thumb': 'https://d2gn4xht817m0g.cloudfront.net/p/product_screenshots/images/thumb/000/605/305/605305-414c6c58806e44f4cfe357622a8011f28285c518.jpg?1445445572', 'original': 'https://d2gn4xht817m0g.cloudfront.net/p/product_screenshots/images/original/000/605/305/605305-ae505050d72b1c63302861cd4677b28608e73adc.jpg?1445445572'}, {'thumb': 'https://d2gn4xht817m0g.cloudfront.net/p/product_screenshots/images/thumb/000/605/306/605306-a4d7f3b6c8c9b7796e390ec4f8eda075c2e2dfd6.jpg?1445445599', 'original': 'https://d2gn4xht817m0g.cloudfront.net/p/product_screenshots/images/original/000/605/306/605306-f60068d5ff9250944b9f1c8b481c989c68b0c4e4.jpg?1445445599'}]",https://d1qb2nb5cznatu.cloudfront.net/startups/i/884489-e168f0b5c51e94cb768375c588fa07f4-medium_jpg.jpg?buster=1445444493,http://www.etutorschool.com,,1-10,https://www.facebook.com/etutorschool,"[{'id': 2071, 'angellist_url': 'https://angel.co/new-york', 'display_name': 'New York', 'name': 'new york', 'tag_type': 'LocationTag'}]",3,https://www.linkedin.com/company/etutor-school,eTutor School,2015-10-21T17:02:02Z,False,"[{'id': 157463, 'angellist_url': 'https://angel.co/online-language-learning', 'display_name': 'Online Language Learning', 'name': 'Online language learning', 'tag_type': 'CompanyTypeTag'}, {'id': 157464, 'angellist_url': 'https://angel.co/foreign-language-learning', 'display_name': 'Foreign Language Learning', 'name': 'Foreign Language Learning', 'tag_type': 'CompanyTypeTag'}]","[{'id': 43, 'angellist_url': 'https://angel.co/education', 'display_name': 'Education', 'name': 'education', 'tag_type': 'MarketTag'}, {'id': 111, 'angellist_url': 'https://angel.co/language-learning', 'display_name': 'Language Learning', 'name': 'language learning', 'tag_type': 'MarketTag'}, {'id': 151533, 'angellist_url': 'https://angel.co/online-education-2', 'display_name': 'Online Education ', 'name': 'online education ', 'tag_type': 'MarketTag'}]",https://twitter.com/etutorschool,,2,2015-10-21T16:21:38Z,http://www.etutorschool.com/blogs/,,https://d1qb2nb5cznatu.cloudfront.net/startups/i/884489-e168f0b5c51e94cb768375c588fa07f4-thumb_jpg.jpg?buster=1445444493,Language Learning Online,"{'intro': {'has': False, 'can': False}}"
886193,False,https://angel.co/eurekkan,,[],https://d1qb2nb5cznatu.cloudfront.net/startups/i/886193-7a285dbafb157ab19e4807b9e6425aa7-medium_jpg.jpg?buster=1445543662,http://none now,,1-10,,"[{'id': 1664, 'angellist_url': 'https://angel.co/new-york-ny-1', 'display_name': 'New York City', 'name': 'new york, ny', 'tag_type': 'LocationTag'}]",4,,Eurekkan,2015-10-22T19:54:28Z,False,[],"[{'id': 3, 'angellist_url': 'https://angel.co/mobile-2', 'display_name': 'Mobile', 'name': 'mobile', 'tag_type': 'MarketTag'}, {'id': 6, 'angellist_url': 'https://angel.co/social-media', 'display_name': 'Social Media', 'name': 'social media', 'tag_type': 'MarketTag'}]",,,2,2015-10-22T19:54:28Z,,,https://d1qb2nb5cznatu.cloudfront.net/startups/i/886193-7a285dbafb157ab19e4807b9e6425aa7-thumb_jpg.jpg?buster=1445543662,Social media/networking,"{'intro': {'has': False, 'can': False}}"
887185,False,https://angel.co/exis,"Exis’ SaaS platform saves software developers time and money by eliminating the need to write repetitive network code, and serving as a one-stop-shop for cloud-based microservices (e.g. user authentication). Developers rely on Exis to provide the secure communication between their mobile and web applications and servers in the cloud - currently a repetitive, error-prone process. Exis also hosts developers’ custom microservices in the cloud - a process that until now, required developers to know at least one additional programming language. Exis means fewer bugs, more security, and shorter time to market for applications. Exis currently has over 70 developers signed up for its beta release.",[],https://d1qb2nb5cznatu.cloudfront.net/startups/i/887185-9de64865f259b04c72b6d3b0089181c0-medium_jpg.jpg?buster=1445621988,http://exis.io,,1-10,,"[{'id': 1655, 'angellist_url': 'https://angel.co/madison', 'display_name': 'Madison', 'name': 'madison', 'tag_type': 'LocationTag'}]",4,,Exis ,2015-10-30T02:20:34Z,False,[],"[{'id': 3127, 'angellist_url': 'https://angel.co/web-development', 'display_name': 'Web Development', 'name': 'web development', 'tag_type': 'MarketTag'}, {'id': 153056, 'angellist_url': 'https://angel.co/programming-6', 'display_name': 'Programming', 'name': 'programming', 'tag_type': 'MarketTag'}, {'id': 153266, 'angellist_url': 'https://angel.co/mobile-application-3', 'display_name': 'Mobile Application', 'name': 'mobile application', 'tag_type': 'MarketTag'}]",,,3,2015-10-23T17:39:56Z,,,https://d1qb2nb5cznatu.cloudfront.net/startups/i/887185-9de64865f259b04c72b6d3b0089181c0-thumb_jpg.jpg?buster=1445621988,One stop shop for cloud microservices,"{'intro': {'has': False, 'can': False}}"
887708,False,https://angel.co/expressviagrarx,"Expressviagrarx.com is an extremely pleased supplier of an exclusive variety of medicines that treats men and women health issues. Expressviagrarx.com is aware of its liability of being the part of the medical market that therefore it contains only those tablets that have accepted clinically and secure to eat. Thus Expressviagrarx.com is a completely focused to the needs to the customers. This web page is truly devoted to the customer satisfaction and thus work hard in offering the top quality drugs. 

Expressviagrarx.com is a simple to use site that provides top quality generic medicines within simply click. We offer only those medicines which effective and result focused on the problems. We don’t implement any marketing expenses on the products that we offer.

Beside this we are available 24*7 for your support our consumer support representative are always there to help you.

Call Us : 1-888-246-3212 Visit: http://www.expressviagrarx.com/generic-viagra",[],https://d1qb2nb5cznatu.cloudfront.net/startups/i/887708-a0985cc0839c88d7a745a16ba66110b5-medium_jpg.jpg?buster=1445670026,http://www.expressviagrarx.com/,,51-200,https://www.facebook.com/expressVrx,"[{'id': 1664, 'angellist_url': 'https://angel.co/new-york-ny-1', 'display_name': 'New York City', 'name': 'new york, ny', 'tag_type': 'LocationTag'}]",1,https://www.linkedin.com/in/expressviagrarx,Expressviagrarx,2015-10-24T07:11:24Z,False,[],"[{'id': 13, 'angellist_url': 'https://angel.co/health-care', 'display_name': 'Health Care', 'name': 'health care', 'tag_type': 'MarketTag'}, {'id': 23, 'angellist_url': 'https://angel.co/pharmaceuticals', 'display_name': 'Pharmaceuticals', 'name': 'pharmaceuticals', 'tag_type': 'MarketTag'}, {'id': 29, 'angellist_url': 'https://angel.co/e-commerce', 'display_name': 'E-Commerce', 'name': 'e-commerce', 'tag_type': 'MarketTag'}]",https://twitter.com/ExpressViagrarx,http://www.crunchbase.com/organization/expressviagrarx,1,2015-10-24T07:00:31Z,,,https://d1qb2nb5cznatu.cloudfront.net/startups/i/887708-a0985cc0839c88d7a745a16ba66110b5-thumb_jpg.jpg?buster=1445670026,https://youtu.be/i9vA-_3x3Vg,"{'intro': {'has': False, 'can': False}}"
885489,False,https://angel.co/factor-fiction-publishing,"We are a small self publishing company eager to help blossoming writters to become budding authors. We seek to polish accepted transcript into a brilliant gem, at which time we will Publish with an assigned ISBN, Advertise with our web stores, have the manuscripts Reviewed for others to see, and Distribute to all major outlets. The author will also have access to reduced priced copies of the work after it's been published as well on top of the free copies delievered after publication. The publication costs are much lower than that of our competitors with the added benefit of personal support. Our authors have a story to tell, whether it is a cook book, a how to, or a novel, each will be treated with the same respect and importance as we work through the process together.",[],https://d1qb2nb5cznatu.cloudfront.net/startups/i/885489-45293184458963ee6819a626ba72c6f1-medium_jpg.jpg?buster=1445500854,http://factorfictionpublishing.wordpress.com,,,,"[{'id': 1840, 'angellist_url': 'https://angel.co/pittsburgh', 'display_name': 'Pittsburgh', 'name': 'pittsburgh', 'tag_type': 'LocationTag'}]",1,,Factor Fiction Publishing,2015-10-22T08:05:38Z,False,[],"[{'id': 87, 'angellist_url': 'https://angel.co/publishing', 'display_name': 'Publishing', 'name': 'publishing', 'tag_type': 'MarketTag'}, {'id': 498, 'angellist_url': 'https://angel.co/e-books', 'display_name': 'E-Books', 'name': 'e books', 'tag_type': 'MarketTag'}]",,,1,2015-10-22T08:00:59Z,,,https://d1qb2nb5cznatu.cloudfront.net/startups/i/885489-45293184458963ee6819a626ba72c6f1-thumb_jpg.jpg?buster=1445500854,"You have a voice, let the world read it","{'intro': {'has': False, 'can': False}}"
882053,False,https://angel.co/feedmob,"FeedMob is the first 100% self serve mobile advertising platform focused on driving new users for mobile application developers and user acquisition managers. No one knows your target audience better than you do, we provide transparent access to tens of thousands of other apps' ad inventory so you can bid directly on the most profitable pockets of users in real time. 

We are currently in beta right now but will be launching in early 2016! 

We love feedback! Get in touch at hello@feedmob.com.",[],https://d1qb2nb5cznatu.cloudfront.net/startups/i/882053-eede18405eb60a402fbde13c431ba3d7-medium_jpg.jpg?buster=1445299511,http://feedmob.com,,,https://www.facebook.com/feedmob,"[{'id': 1621, 'angellist_url': 'https://angel.co/boulder', 'display_name': 'Boulder', 'name': 'boulder', 'tag_type': 'LocationTag'}, {'id': 1664, 'angellist_url': 'https://angel.co/new-york-ny-1', 'display_name': 'New York City', 'name': 'new york, ny', 'tag_type': 'LocationTag'}]",5,http://linkedin.com/company/feedmob,FeedMob,2015-10-20T00:10:30Z,False,[],"[{'id': 3, 'angellist_url': 'https://angel.co/mobile-2', 'display_name': 'Mobile', 'name': 'mobile', 'tag_type': 'MarketTag'}, {'id': 34, 'angellist_url': 'https://angel.co/advertising', 'display_name': 'Advertising', 'name': 'advertising', 'tag_type': 'MarketTag'}, {'id': 205, 'angellist_url': 'https://angel.co/mobile-advertising', 'display_name': 'Mobile Advertising', 'name': 'mobile advertising', 'tag_type': 'MarketTag'}]",,http://www.crunchbase.com/organization/feedmob,3,2015-10-20T00:05:15Z,,,https://d1qb2nb5cznatu.cloudfront.net/startups/i/882053-eede18405eb60a402fbde13c431ba3d7-thumb_jpg.jpg?buster=1445299511,Feed Your Mobile Apps,"{'intro': {'has': False, 'can': False}}"
882246,False,https://angel.co/fences-kinetik-technologies-inc,We are excited to be building 'Fences for Business' to radically change the way businesses interact with their customers and field teams. Fences is a Geolocation Engagement Platform that exposes a real-time map and engagement channel between you and your customers. Learn more at http://getfences.com,"[{'thumb': 'https://d2gn4xht817m0g.cloudfront.net/p/product_screenshots/images/thumb/000/604/468/604468-4b4545e0b1da0c1a4d3a7ed414b275fdb7ea7e4c.jpg?1445318003', 'original': 'https://d2gn4xht817m0g.cloudfront.net/p/product_screenshots/images/original/000/604/468/604468-f9f1439fe884f8ae3ae5a0ef0de6d8241c94d615.jpg?1445318003'}]",https://d1qb2nb5cznatu.cloudfront.net/startups/i/882246-7707309b6147a0bfd5aa541d0704a324-medium_jpg.jpg?buster=1445317462,http://getfences.com,,,https://www.facebook.com/getfences,"[{'id': 1626, 'angellist_url': 'https://angel.co/chicago', 'display_name': 'Chicago', 'name': 'chicago', 'tag_type': 'LocationTag'}]",3,,Fences (Kinetik Technologies Inc.),2015-10-20T05:11:26Z,False,[],"[{'id': 3, 'angellist_url': 'https://angel.co/mobile-2', 'display_name': 'Mobile', 'name': 'mobile', 'tag_type': 'MarketTag'}, {'id': 57, 'angellist_url': 'https://angel.co/location-based-services', 'display_name': 'Location Based Services', 'name': 'location based services', 'tag_type': 'MarketTag'}, {'id': 155743, 'angellist_url': 'https://angel.co/real-time-gps-fleet-monitoring-services', 'display_name': 'Real Time Gps Fleet Monitoring Services', 'name': 'Real-time GPS Fleet Monitoring Services', 'tag_type': 'MarketTag'}, {'id': 157788, 'angellist_url': 'https://angel.co/consumer-engagement-2', 'display_name': 'Consumer Engagement', 'name': 'consumer engagement', 'tag_type': 'MarketTag'}]",https://twitter.com/getfences,,2,2015-10-20T05:04:28Z,,,https://d1qb2nb5cznatu.cloudfront.net/startups/i/882246-7707309b6147a0bfd5aa541d0704a324-thumb_jpg.jpg?buster=1445317462,Real-time Geolocation Engagement Platform for Business and Consumers,"{'intro': {'has': False, 'can': False}}"
888954,False,https://angel.co/fenrir-1,"Fenrir is a restaurant focusing on hyper-seasonal local produce and meats, in-house fermentation and microbiological food projects, functioning as the backbone for a chemistry and philosophy laboratory.

Our customers see the restaurant as a fantastic semi-Scandinavian modern restaurant. Our employees see the restaurant as a laboratory for new discoveries in farming, cooking, service, and food community exploration.

We are looking to expand to a new location and are looking for funding.","[{'thumb': 'https://d2gn4xht817m0g.cloudfront.net/p/product_screenshots/images/thumb/000/606/886/606886-2a3220b4e359d440ad1f1f01a14b0e68f6811851.jpg?1445816792', 'original': 'https://d2gn4xht817m0g.cloudfront.net/p/product_screenshots/images/original/000/606/886/606886-11169fa1cedc70954e62a7597f91381d0b234107.jpg?1445816792'}, {'thumb': 'https://d2gn4xht817m0g.cloudfront.net/p/product_screenshots/images/thumb/000/606/887/606887-3148c1f123ce5c7699360df3c06b2d4c244ea792.jpg?1445816898', 'original': 'https://d2gn4xht817m0g.cloudfront.net/p/product_screenshots/images/original/000/606/887/606887-52ca113c6d1a25371014b2cef4b22e824af2546b.jpg?1445816898'}, {'thumb': 'https://d2gn4xht817m0g.cloudfront.net/p/product_screenshots/images/thumb/000/606/888/606888-9d19a6b27c883c40b23946c42ca37fe4c92dda6e.jpg?1445816949', 'original': 'https://d2gn4xht817m0g.cloudfront.net/p/product_screenshots/images/original/000/606/888/606888-c2e23f217f88f2a8d17260dad03b045654a93114.jpg?1445816949'}]",https://d1qb2nb5cznatu.cloudfront.net/startups/i/888954-d27b7ec82606d72f433efa0b9229d0e3-medium_jpg.jpg?buster=1445816601,http://fenrirpdx.com,,,,"[{'id': 1673, 'angellist_url': 'https://angel.co/portland', 'display_name': 'Portland', 'name': 'portland', 'tag_type': 'LocationTag'}]",3,,Fenrir,2015-10-25T23:49:33Z,False,[],"[{'id': 72, 'angellist_url': 'https://angel.co/food-and-beverages', 'display_name': 'Food and Beverages', 'name': 'food and beverages', 'tag_type': 'MarketTag'}, {'id': 263, 'angellist_url': 'https://angel.co/restaurants-1', 'display_name': 'Restaurants', 'name': 'restaurants', 'tag_type': 'MarketTag'}, {'id': 1445, 'angellist_url': 'https://angel.co/specialty-foods', 'display_name': 'Specialty Foods', 'name': 'specialty foods', 'tag_type': 'MarketTag'}, {'id': 156346, 'angellist_url': 'https://angel.co/food-trucks-and-or-restaurants', 'display_name': 'Food Trucks And/Or Restaurants', 'name': 'food trucks And/Or restaurants', 'tag_type': 'MarketTag'}]",,,1,2015-10-25T23:43:25Z,,,https://d1qb2nb5cznatu.cloudfront.net/startups/i/888954-d27b7ec82606d72f433efa0b9229d0e3-thumb_jpg.jpg?buster=1445816601,Fermentation Science Oriented Restaurant,"{'intro': {'has': False, 'can': False}}"
885970,False,https://angel.co/ferro-entertainment-1,"We make games for mobile devices. Indie mobile game studios make high quality games, but fail to generate profits. Those studios spend together on user acquisition more than 1.2 Billion Dollar a year, while losing 77 cents for every new user. FE Developers’ profits to a positive game discovery experience, instead of annoying banners. Moreover, we bring users that already tried the game, liked it and decided to download it, meaning they have higher ROI and better retention.",[],https://d1qb2nb5cznatu.cloudfront.net/startups/i/885970-5deb92cef4b8851b1ebc7c8fbbc80d9e-medium_jpg.jpg?buster=1445533938,https://www.facebook.com/asjioentertainment,,,https://www.facebook.com/asjioentertainment,"[{'id': 1692, 'angellist_url': 'https://angel.co/san-francisco', 'display_name': 'San Francisco', 'name': 'san francisco', 'tag_type': 'LocationTag'}]",1,,Ferro Entertainment,2015-10-22T18:28:55Z,False,[],"[{'id': 14, 'angellist_url': 'https://angel.co/games', 'display_name': 'Games', 'name': 'games', 'tag_type': 'MarketTag'}, {'id': 490, 'angellist_url': 'https://angel.co/mobile-games-1', 'display_name': 'Mobile Games', 'name': 'mobile games', 'tag_type': 'MarketTag'}, {'id': 836, 'angellist_url': 'https://angel.co/apps', 'display_name': 'Apps', 'name': 'apps', 'tag_type': 'MarketTag'}, {'id': 1429, 'angellist_url': 'https://angel.co/digital-entertainment', 'display_name': 'Digital Entertainment', 'name': 'digital entertainment', 'tag_type': 'MarketTag'}]",https://twitter.com/ferro_studio,,1,2015-10-22T17:12:24Z,,,https://d1qb2nb5cznatu.cloudfront.net/startups/i/885970-5deb92cef4b8851b1ebc7c8fbbc80d9e-thumb_jpg.jpg?buster=1445533938,Games For Everyone,"{'intro': {'has': False, 'can': False}}"
886041,False,https://angel.co/financial-analytics-company,Financial Analytics,[],https://d1qb2nb5cznatu.cloudfront.net/startups/i/886041-153f84c63036e27252754d94e39c2914-medium_jpg.jpg?buster=1445537111,http://www.garrison-assoc.com,,51-200,,"[{'id': 1664, 'angellist_url': 'https://angel.co/new-york-ny-1', 'display_name': 'New York City', 'name': 'new york, ny', 'tag_type': 'LocationTag'}]",3,,Financial Analytics Company,2015-10-22T19:02:28Z,False,[],"[{'id': 17, 'angellist_url': 'https://angel.co/financial-services-1', 'display_name': 'Financial Services', 'name': 'financial services', 'tag_type': 'MarketTag'}]",,,1,2015-10-22T18:05:16Z,,,https://d1qb2nb5cznatu.cloudfront.net/startups/i/886041-153f84c63036e27252754d94e39c2914-thumb_jpg.jpg?buster=1445537111,Risk Management,"{'intro': {'has': False, 'can': False}}"
884501,False,https://angel.co/first-securities,"The product is an all-inclusive outsourcing platform for financial institutions that provides them with access to marketing, products, services and technology.  Not all financial institutions are created equally, and thus lack resources to market and are limited on the products and services they offer to their customers.  These limitations decreases their earnings potential significantly.  The innovative concept has elements of both a collaborative and a consortium to increase income and reduce overhead. The Great Recession that spanned two years, resulted in a severe decline in economic activity. 
Nationwide numerous financial institutions suffered major losses, and many still remain financially troubled or too small to compete with their peers.  Institutions are at risk of closure or missing out on income opportunities because they lack resources to market and staff.  The product provides scale making it feasible for growth, while reducing costs.  A patent is currently pending.",[],https://d1qb2nb5cznatu.cloudfront.net/startups/i/884501-ff4deaf13d18b12fd5a5dbfe96bbad63-medium_jpg.jpg?buster=1445448319,http://www.underdevelopment.com,,,,"[{'id': 1630, 'angellist_url': 'https://angel.co/cleveland', 'display_name': 'Cleveland', 'name': 'cleveland', 'tag_type': 'LocationTag'}]",1,,First Securities,2015-10-21T17:28:24Z,False,[],"[{'id': 17, 'angellist_url': 'https://angel.co/financial-services-1', 'display_name': 'Financial Services', 'name': 'financial services', 'tag_type': 'MarketTag'}]",,,1,2015-10-21T16:32:34Z,,,https://d1qb2nb5cznatu.cloudfront.net/startups/i/884501-ff4deaf13d18b12fd5a5dbfe96bbad63-thumb_jpg.jpg?buster=1445448319,Patent Pending Outsourcing Platform for Financial Institutions,"{'intro': {'has': False, 'can': False}}"
