id,hidden,angellist_url,product_desc,screenshots,logo_url,company_url,video_url,company_size,facebook_url,locations,quality,linkedin_url,name,updated_at,community_profile,company_type,markets,twitter_url,crunchbase_url,follower_count,created_at,blog_url,status,thumb_url,high_concept,abilities
885429,False,https://angel.co/loadtap-1,"Loadtap is an on demand platform that allows small trucking companies, who are underserved by current solutions, and their brokers to streamline and optimize their operations for freight booking, tracking and management. Brokers can book their loads on Loadtap either with carriers in their private network or open for public bidding. Carriers dispatch load details to their drivers’ mobile app, obtain truck tracking and load status in real-time which is shared with their brokers. Loadtap allows both carriers and brokers to manage their current and past loads and provides online documentation support. Loadtap helps eliminate inefficiencies and create new business opportunities for both carriers and brokers by expanding their network.",[],https://d1qb2nb5cznatu.cloudfront.net/startups/i/885429-a3aaca6bb2d6eda8a1faece31385d7dc-medium_jpg.jpg?buster=1445493767,http://www.loadtap.com,,1-10,http://www.facebook.com/loadtap,"[{'id': 1701, 'angellist_url': 'https://angel.co/mountain-view-1', 'display_name': 'Mountain View', 'name': 'mountain view', 'tag_type': 'LocationTag'}]",4,,Loadtap,2015-10-22T07:54:41Z,False,[],"[{'id': 3, 'angellist_url': 'https://angel.co/mobile-2', 'display_name': 'Mobile', 'name': 'mobile', 'tag_type': 'MarketTag'}, {'id': 10, 'angellist_url': 'https://angel.co/saas', 'display_name': 'SaaS', 'name': 'SaaS', 'tag_type': 'MarketTag'}, {'id': 631, 'angellist_url': 'https://angel.co/transportation', 'display_name': 'Transportation', 'name': 'transportation', 'tag_type': 'MarketTag'}, {'id': 151686, 'angellist_url': 'https://angel.co/logistics-software', 'display_name': 'Logistics Software', 'name': 'logistics software', 'tag_type': 'MarketTag'}]",http://www.twitter.com/loadtap,,4,2015-10-22T06:02:52Z,,,https://d1qb2nb5cznatu.cloudfront.net/startups/i/885429-a3aaca6bb2d6eda8a1faece31385d7dc-thumb_jpg.jpg?buster=1445493767,Connecting the trucking industry,"{'intro': {'has': False, 'can': False}}"
886112,False,https://angel.co/love-theatre-ensemble,The product is having a cathartic moment that shifts your prospective. It helps the customers mindset.,[],https://d1qb2nb5cznatu.cloudfront.net/startups/i/886112-ca679005bf28e4fa07f89e548e85293a-medium_jpg.jpg?buster=1445540265,http://Lovetheatreensemble.org,,,,"[{'id': 1617, 'angellist_url': 'https://angel.co/austin', 'display_name': 'Austin', 'name': 'austin', 'tag_type': 'LocationTag'}]",1,,Love Theatre Ensemble,2015-10-22T18:57:51Z,False,[],"[{'id': 63, 'angellist_url': 'https://angel.co/adult', 'display_name': 'Adult', 'name': 'adult', 'tag_type': 'MarketTag'}, {'id': 912, 'angellist_url': 'https://angel.co/teenagers', 'display_name': 'Teenagers', 'name': 'teenagers', 'tag_type': 'MarketTag'}, {'id': 8555, 'angellist_url': 'https://angel.co/underserved-children', 'display_name': 'Underserved Children', 'name': 'underserved children', 'tag_type': 'MarketTag'}, {'id': 155158, 'angellist_url': 'https://angel.co/pre-teen', 'display_name': 'Pre Teen', 'name': 'Pre-Teen', 'tag_type': 'MarketTag'}]",,,1,2015-10-22T18:57:51Z,,,https://d1qb2nb5cznatu.cloudfront.net/startups/i/886112-ca679005bf28e4fa07f89e548e85293a-thumb_jpg.jpg?buster=1445540265,"We promote respect, love and tolerance through performing.","{'intro': {'has': False, 'can': False}}"
883546,False,https://angel.co/lunera-lighting-1,"Lunera makes LED lighting simple. We engineer lamps that are easy to install, generate huge savings, and set a new standard for reliability.

We work with companies such as Bosch, Apple, Google, Facebook and Ebay to design and implement innovative and energy efficient LED lighting solutions.
 
Our plug-and-play LED lamps directly replace CFL, Metal Halides and High-Pressure Sodium lamps without any re-wiring of the fixture.  The result is the simplest, most cost effective solution to convert your existing lighting infrastructure to LED.  

Companies need to move to LED, we make it easy.","[{'thumb': 'https://d2gn4xht817m0g.cloudfront.net/p/product_screenshots/images/thumb/000/604/892/604892-3f056cec535a3cf90fe721812ece440cd5b26119.jpg?1445382930', 'original': 'https://d2gn4xht817m0g.cloudfront.net/p/product_screenshots/images/original/000/604/892/604892-d3ef96bfcb570fb1e44244fff1a73b60ee1ec114.png?1445382930'}]",https://d1qb2nb5cznatu.cloudfront.net/startups/i/883546-abfd9dec3234ac977ba2bfba825dc871-medium_jpg.jpg?buster=1445382744,http://lunera.com,,,,"[{'id': 1692, 'angellist_url': 'https://angel.co/san-francisco', 'display_name': 'San Francisco', 'name': 'san francisco', 'tag_type': 'LocationTag'}]",3,,Lunera Lighting,2015-10-20T23:15:58Z,False,[],"[{'id': 571, 'angellist_url': 'https://angel.co/lighting', 'display_name': 'Lighting', 'name': 'lighting', 'tag_type': 'MarketTag'}, {'id': 1948, 'angellist_url': 'https://angel.co/sustainability', 'display_name': 'Sustainability', 'name': 'sustainability', 'tag_type': 'MarketTag'}, {'id': 2678, 'angellist_url': 'https://angel.co/green-building', 'display_name': 'Green Building', 'name': 'green building', 'tag_type': 'MarketTag'}, {'id': 11022, 'angellist_url': 'https://angel.co/smart-building', 'display_name': 'Smart Building', 'name': 'smart building', 'tag_type': 'MarketTag'}]",,,3,2015-10-20T23:12:29Z,,,https://d1qb2nb5cznatu.cloudfront.net/startups/i/883546-abfd9dec3234ac977ba2bfba825dc871-thumb_jpg.jpg?buster=1445382744,The simplest way to covert to LED.,"{'intro': {'has': False, 'can': False}}"
882121,False,https://angel.co/lyft-brands-group,,[],https://d1qb2nb5cznatu.cloudfront.net/startups/i/882121-9e0079473ff0745073355c7dc82b1c03-medium_jpg.jpg?buster=1445304967,,,,,"[{'id': 1664, 'angellist_url': 'https://angel.co/new-york-ny-1', 'display_name': 'New York City', 'name': 'new york, ny', 'tag_type': 'LocationTag'}]",4,,Lyft Brands Group,2015-10-20T01:36:12Z,False,[],[],,,2,2015-10-20T01:33:26Z,,,https://d1qb2nb5cznatu.cloudfront.net/startups/i/882121-9e0079473ff0745073355c7dc82b1c03-thumb_jpg.jpg?buster=1445304967,,"{'intro': {'has': False, 'can': False}}"
883181,False,https://angel.co/magicstick,"MagicStick is the world’s most powerful computer on stick with new Intel’s almighty Cherry Trail Processor, 8GB RAM and 256 Gb solid storage. It comes with Windows 10 and Android Lollipop preloaded but it supports all variants of Linux. You will be able to access and browse the internet from your tv, to stream and watch 4k movies, to shop on-line and play your favorite 3D video games.","[{'thumb': 'https://d2gn4xht817m0g.cloudfront.net/p/product_screenshots/images/thumb/000/604/930/604930-6c97ab9e2b3c602dffe1ab87987eddc3693c21a9.jpg?1445390624', 'original': 'https://d2gn4xht817m0g.cloudfront.net/p/product_screenshots/images/original/000/604/930/604930-71fca86e904a017a6961c0481ffb0df55b4b6967.jpg?1445390624'}, {'thumb': 'https://d2gn4xht817m0g.cloudfront.net/p/product_screenshots/images/thumb/000/604/948/604948-0ed5c19d3a37486a8e908a2d46773fc62a73416f.jpg?1445392001', 'original': 'https://d2gn4xht817m0g.cloudfront.net/p/product_screenshots/images/original/000/604/948/604948-ca25078878b82b06a3fdc35cda471b1b112ef6b1.jpg?1445392001'}, {'thumb': 'https://d2gn4xht817m0g.cloudfront.net/p/product_screenshots/images/thumb/000/604/949/604949-66c760383b5504ccc0ad1e70dbc81e8372b6d6a0.jpg?1445392049', 'original': 'https://d2gn4xht817m0g.cloudfront.net/p/product_screenshots/images/original/000/604/949/604949-3c90d2b0d34a5aebab0321c6f9e77bdfee70e657.jpg?1445392049'}]",https://d1qb2nb5cznatu.cloudfront.net/startups/i/883181-97b06db36588742635bd109a74b6b01b-medium_jpg.jpg?buster=1445391541,http://www.magicstick.net,,1-10,https://www.facebook.com/MagicStick.PcTv,"[{'id': 1904, 'angellist_url': 'https://angel.co/bangalore', 'display_name': 'Bangalore', 'name': 'bangalore', 'tag_type': 'LocationTag'}, {'id': 34903, 'angellist_url': 'https://angel.co/california-city', 'display_name': 'California City', 'name': 'california city', 'tag_type': 'LocationTag'}]",3,,MagicStick,2015-10-21T18:50:08Z,False,[],"[{'id': 286, 'angellist_url': 'https://angel.co/consumer-electronics', 'display_name': 'Consumer Electronics', 'name': 'consumer electronics', 'tag_type': 'MarketTag'}, {'id': 13764, 'angellist_url': 'https://angel.co/hardware-software', 'display_name': 'Hardware + Software', 'name': 'hardware + software', 'tag_type': 'MarketTag'}]",https://twitter.com/MagicStick_PcTv,,2,2015-10-20T18:55:27Z,,"{'message': 'Get the MagicStick Wave Early bird offer @$249', 'created_at': '2015-10-21T18:48:18Z', 'id': 199892}",https://d1qb2nb5cznatu.cloudfront.net/startups/i/883181-97b06db36588742635bd109a74b6b01b-thumb_jpg.jpg?buster=1445391541,MagicStick - The Powerful PC Ever Made,"{'intro': {'has': False, 'can': False}}"
885509,False,https://angel.co/mail-prospects,"Mail Prospects is a leading email marketing service provider that offers updated, comprehensive lists of prospective clients to various industrial sectors. We specialize in providing mailing list solutions to small, medium and large business enterprises looking to promote their products and services to the right target markets.  

Powered by the highest quality business contact databases, our services include providing highly specific and target-oriented business mailing lists, B2B mailing lists,targeted mailing lists, custom mailing lists, industry mailing lists, technology users’ mailing list, direct marketing solutions and ongoing sales leads. Our mailing list solutions have evolved with time and are known to provide desired results.

Website: http://mail-prospects.com/",[],https://d1qb2nb5cznatu.cloudfront.net/startups/i/885509-8197b670d545be3e0c1bb49a6328b26b-medium_jpg.jpg?buster=1445502572,http://mail-prospects.com/,,,,"[{'id': 1704, 'angellist_url': 'https://angel.co/las-vegas', 'display_name': 'Las Vegas', 'name': 'las vegas', 'tag_type': 'LocationTag'}]",1,,Mail Prospects,2015-10-22T09:19:58Z,False,[],"[{'id': 51, 'angellist_url': 'https://angel.co/sales-and-marketing-1', 'display_name': 'Sales and Marketing', 'name': 'sales and marketing', 'tag_type': 'MarketTag'}, {'id': 82, 'angellist_url': 'https://angel.co/direct-marketing', 'display_name': 'Direct Marketing', 'name': 'direct marketing', 'tag_type': 'MarketTag'}, {'id': 657, 'angellist_url': 'https://angel.co/email-marketing', 'display_name': 'Email Marketing', 'name': 'email marketing', 'tag_type': 'MarketTag'}]",,,1,2015-10-22T08:29:37Z,,,https://d1qb2nb5cznatu.cloudfront.net/startups/i/885509-8197b670d545be3e0c1bb49a6328b26b-thumb_jpg.jpg?buster=1445502572,World's Leader in Providing Mailing Lists,"{'intro': {'has': False, 'can': False}}"
884810,False,https://angel.co/mango-3,"MANGO is a free mobile application that helps students connect with alumni mentors who match their unique needs easily and confidently.

MANGO acts as networking training wheels to show students how easy and useful it is to access mentoring advice from their alumni network for things like internships, jobs, job shadows, and informational interviews. Everything from the brand name and personalized matching algorithm to the auto-draft messaging and smart coaching features are designed for novice networkers. Along the way, students build network connections that open doors to their desired careers.  

MANGO helps universities to increase the career outcomes of its students without labor-intensive processes, which in turn attracts enrollment, increases student retention, and expands alumni giving.",[],https://d1qb2nb5cznatu.cloudfront.net/startups/i/884810-4bf9b3d3386b3db803a1599d6a1da886-medium_jpg.jpg?buster=1445457306,http://www.irving-ventures.com/#!mangomentors/c189k,,,,"[{'id': 1927, 'angellist_url': 'https://angel.co/minneapolis', 'display_name': 'Minneapolis', 'name': 'minneapolis', 'tag_type': 'LocationTag'}]",3,,MANGO,2015-10-21T20:43:21Z,False,[],"[{'id': 3, 'angellist_url': 'https://angel.co/mobile-2', 'display_name': 'Mobile', 'name': 'mobile', 'tag_type': 'MarketTag'}, {'id': 152028, 'angellist_url': 'https://angel.co/higher-education-2', 'display_name': 'Higher Education', 'name': 'Higher Education', 'tag_type': 'MarketTag'}]",,,1,2015-10-21T19:55:11Z,,,https://d1qb2nb5cznatu.cloudfront.net/startups/i/884810-4bf9b3d3386b3db803a1599d6a1da886-thumb_jpg.jpg?buster=1445457306,MANGO is OKCupid for student-alumni networking.,"{'intro': {'has': False, 'can': False}}"
888319,False,https://angel.co/market-sensei,"Market Sensei gives a stock's most likely low,high,opening & closing prices - daily. So you are comfortable in making your investment and trading decisions. You can also explore interesting stocks in a more fun way.
Your Stock Market Sensei
Market Sensei answers the most important investment & trading questions. e.g Today, what is the best price to buy a stock or sell the stock? What is the reasonable return to expect? What will be the day's price range and volatility. It lets you put the odds back in your favor.

Daily Updates
Unlike other apps, Market Sensei automatically updates with relevant analysis for the next trading day at 7PM EST. The update includes enhancements based on the current day's trading data to maintain superior performance.

Stock Widget
Market Sensei's stock widget tells you at a glance the bullishness of your last searched stock and its current price.  Place the widget anywhere on your home-screen for easy access.","[{'thumb': 'https://d2gn4xht817m0g.cloudfront.net/p/product_screenshots/images/thumb/000/606/708/606708-60a5b012f3b298a7b75bd8ef5b0cb42dbc1d4086.jpg?1445747853', 'original': 'https://d2gn4xht817m0g.cloudfront.net/p/product_screenshots/images/original/000/606/708/606708-e281007f9df1908d883dc18d557defb9f8c965b0.png?1445747853'}, {'thumb': 'https://d2gn4xht817m0g.cloudfront.net/p/product_screenshots/images/thumb/000/606/709/606709-87808ea03e54bb11f362670a81568a8f73de2911.jpg?1445747881', 'original': 'https://d2gn4xht817m0g.cloudfront.net/p/product_screenshots/images/original/000/606/709/606709-7cc60a1482e5aeb374f3b0290fe2b3f6fb7920db.png?1445747881'}, {'thumb': 'https://d2gn4xht817m0g.cloudfront.net/p/product_screenshots/images/thumb/000/606/710/606710-f8273247588da72ea648927236323d33d4b3cdfb.jpg?1445747911', 'original': 'https://d2gn4xht817m0g.cloudfront.net/p/product_screenshots/images/original/000/606/710/606710-cbbd7b587d98a5d45f7ec69397d632297fd066c5.png?1445747911'}, {'thumb': 'https://d2gn4xht817m0g.cloudfront.net/p/product_screenshots/images/thumb/000/606/711/606711-75f614f23bd23517e06eef977e7275ff511c070e.jpg?1445747933', 'original': 'https://d2gn4xht817m0g.cloudfront.net/p/product_screenshots/images/original/000/606/711/606711-50ff7e88835d5bf30be4e74ac8a908afc3911f62.png?1445747933'}, {'thumb': 'https://d2gn4xht817m0g.cloudfront.net/p/product_screenshots/images/thumb/000/606/712/606712-2cd26a8981db2e1f7059d212f0ca8b0c56c87e86.jpg?1445747958', 'original': 'https://d2gn4xht817m0g.cloudfront.net/p/product_screenshots/images/original/000/606/712/606712-be6d5dcaf597c2e2f1e5fa41f76aaceb46dc1087.png?1445747958'}, {'thumb': 'https://d2gn4xht817m0g.cloudfront.net/p/product_screenshots/images/thumb/000/606/780/606780-8519c7cbe5f4d25b90dca5d2b8ff8dbf5f1cc57b.jpg?1445775994', 'original': 'https://d2gn4xht817m0g.cloudfront.net/p/product_screenshots/images/original/000/606/780/606780-cbba4224e0100fd7f2ee42c99b1fc27291335615.png?1445775994'}]",https://d1qb2nb5cznatu.cloudfront.net/startups/i/888319-12fd48413c823522d11899085de4d2c7-medium_jpg.jpg?buster=1445775947,https://play.google.com/store/apps/details?id=com.kwete.marketsensei,,1-10,,"[{'id': 1620, 'angellist_url': 'https://angel.co/boston', 'display_name': 'Boston', 'name': 'boston', 'tag_type': 'LocationTag'}]",4,,Market Sensei,2015-10-25T12:27:47Z,False,[],"[{'id': 3, 'angellist_url': 'https://angel.co/mobile-2', 'display_name': 'Mobile', 'name': 'mobile', 'tag_type': 'MarketTag'}, {'id': 374, 'angellist_url': 'https://angel.co/personal-finance', 'display_name': 'Personal Finance', 'name': 'personal finance', 'tag_type': 'MarketTag'}, {'id': 2947, 'angellist_url': 'https://angel.co/finance-technology', 'display_name': 'Finance Technology', 'name': 'finance technology', 'tag_type': 'MarketTag'}]",,,1,2015-10-25T04:25:30Z,,,https://d1qb2nb5cznatu.cloudfront.net/startups/i/888319-12fd48413c823522d11899085de4d2c7-thumb_jpg.jpg?buster=1445775947,Daily Stock Forecasts,"{'intro': {'has': False, 'can': False}}"
886130,False,https://angel.co/mdpress-com,"Medical search engine and content curation platform for clinicians, researchers, biotech and pharmaceutical organizations.  We aggregate biomedical literature, clinical trials, medical conferences, industry news, regulatory announcements, social media, and scientific activity of the worlds leading medical experts.  We are currently focused in oncology and dermatology but rapidly expanding into new therapeutic areas.",[],https://d1qb2nb5cznatu.cloudfront.net/startups/i/886130-2238be07b8a82f6de6a657164d6168da-medium_jpg.jpg?buster=1445541018,http://www.mdpress.com,,1-10,,"[{'id': 1664, 'angellist_url': 'https://angel.co/new-york-ny-1', 'display_name': 'New York City', 'name': 'new york, ny', 'tag_type': 'LocationTag'}]",3,,mdpress.com,2015-10-23T18:24:39Z,False,"[{'id': 135588, 'angellist_url': 'https://angel.co/healthtech', 'display_name': 'Health Tech', 'name': 'HealthTech', 'tag_type': 'CompanyTypeTag'}, {'id': 140603, 'angellist_url': 'https://angel.co/saas-4', 'display_name': 'SaaS', 'name': 'SaaS', 'tag_type': 'CompanyTypeTag'}]","[{'id': 12, 'angellist_url': 'https://angel.co/enterprise-software', 'display_name': 'Enterprise Software', 'name': 'enterprise software', 'tag_type': 'MarketTag'}, {'id': 175, 'angellist_url': 'https://angel.co/health-care-information-technology', 'display_name': 'Health Care Information Technology', 'name': 'health care information technology', 'tag_type': 'MarketTag'}]",,,2,2015-10-22T19:10:25Z,,,https://d1qb2nb5cznatu.cloudfront.net/startups/i/886130-2238be07b8a82f6de6a657164d6168da-thumb_jpg.jpg?buster=1445541018,Pharmaceutical and Biotech Medical Discovery Platform,"{'intro': {'has': False, 'can': False}}"
886304,False,https://angel.co/mexiabiz,"
I am working with people who have conducted numerous successful trades along the years. It covers in forex, currency and instrument monetization markets. 
We have counterparts set in European top banks able to receive instruments to fund currency trade that's historically performed around 12% minimum per average calendar month. Performance is not designated nor guaranteed upon the understanding the nature of the trade. A clear performance sheet can be provided upon your submission of your file. 

If cash fund we can set your own trade account which will be under your own name. A trading entity will be nominated to you as counterpart to engage for 90days minimum trading period. During trading such fund is blocked. When he/she no longer wishes to continue the trade a written 30days in advance notice shall be given to their counterpart. The minimum cash fund to trade is USD300.000. 

One of the purposes of raising this capital is for further angel investing.",[],https://d1qb2nb5cznatu.cloudfront.net/startups/i/886304-13cbf4c8c9e2fa25767c014478a3e971-medium_jpg.jpg?buster=1445549929,http://not available,,,,"[{'id': 2071, 'angellist_url': 'https://angel.co/new-york', 'display_name': 'New York', 'name': 'new york', 'tag_type': 'LocationTag'}, {'id': 1664, 'angellist_url': 'https://angel.co/new-york-ny-1', 'display_name': 'New York City', 'name': 'new york, ny', 'tag_type': 'LocationTag'}]",1,,Mexiabiz,2015-10-22T21:38:53Z,False,[],"[{'id': 856, 'angellist_url': 'https://angel.co/venture-capital', 'display_name': 'Venture Capital', 'name': 'venture capital', 'tag_type': 'MarketTag'}, {'id': 153018, 'angellist_url': 'https://angel.co/capital-raising-2', 'display_name': 'Capital Raising', 'name': 'Capital Raising', 'tag_type': 'MarketTag'}, {'id': 156285, 'angellist_url': 'https://angel.co/investors-1', 'display_name': 'Investors', 'name': 'investors', 'tag_type': 'MarketTag'}]",,,1,2015-10-22T21:38:53Z,,,https://d1qb2nb5cznatu.cloudfront.net/startups/i/886304-13cbf4c8c9e2fa25767c014478a3e971-thumb_jpg.jpg?buster=1445549929,capital raising for social and private entrpreneurship,"{'intro': {'has': False, 'can': False}}"
885076,False,https://angel.co/miiwireless,"The average cell phone bill in the US is now over $100/month. We think that is crazy. MiiWireless was founded with the idea that a technology-driven phone carrier could operate with significantly less overhead. We cut out the fat that makes other carriers so costly.

We offer one plan that includes unlimited talk, text, 3gb data, adblock, insurance and the latest basic iOS or Android device.","[{'thumb': 'https://d2gn4xht817m0g.cloudfront.net/p/product_screenshots/images/thumb/000/605/485/605485-1dfcdbf0b69e64c3da72e9615f4994a22c7da8c3.jpg?1445468831', 'original': 'https://d2gn4xht817m0g.cloudfront.net/p/product_screenshots/images/original/000/605/485/605485-0a064ca4943ea813e1eae5023e61e35af1b7ed0a.png?1445468831'}]",https://d1qb2nb5cznatu.cloudfront.net/startups/i/885076-7025cb923d863549054824e164019506-medium_jpg.jpg?buster=1445468319,http://www.miiwireless.com,,,,"[{'id': 1653, 'angellist_url': 'https://angel.co/los-angeles', 'display_name': 'Los Angeles', 'name': 'los angeles', 'tag_type': 'LocationTag'}]",3,,MiiWireless,2015-10-23T00:44:15Z,False,[],"[{'id': 3, 'angellist_url': 'https://angel.co/mobile-2', 'display_name': 'Mobile', 'name': 'mobile', 'tag_type': 'MarketTag'}, {'id': 34, 'angellist_url': 'https://angel.co/advertising', 'display_name': 'Advertising', 'name': 'advertising', 'tag_type': 'MarketTag'}, {'id': 49, 'angellist_url': 'https://angel.co/telecommunications', 'display_name': 'Telecommunications', 'name': 'telecommunications', 'tag_type': 'MarketTag'}]",,,1,2015-10-21T22:58:46Z,,,https://d1qb2nb5cznatu.cloudfront.net/startups/i/885076-7025cb923d863549054824e164019506-thumb_jpg.jpg?buster=1445468319,Technology driven MVNO,"{'intro': {'has': False, 'can': False}}"
887184,False,https://angel.co/mindful-food,"We produce VEGAN, NON GMO, healthy ready to eat frozen entrees.  Everything is hand made and manufactured in Los Angeles.  We procure our ingredients from local vendors.","[{'thumb': 'https://d2gn4xht817m0g.cloudfront.net/p/product_screenshots/images/thumb/000/606/321/606321-a60ce811d335f2c394942ce97eb88ac933c37557.jpg?1445622086', 'original': 'https://d2gn4xht817m0g.cloudfront.net/p/product_screenshots/images/original/000/606/321/606321-dc30d701d268a57eba60f2a51b30a6ad4e5b8d0d.jpg?1445622086'}, {'thumb': 'https://d2gn4xht817m0g.cloudfront.net/p/product_screenshots/images/thumb/000/606/322/606322-710b705202cc37d95bf05f47d63f6c2fb1d876b6.jpg?1445622137', 'original': 'https://d2gn4xht817m0g.cloudfront.net/p/product_screenshots/images/original/000/606/322/606322-d1119656af22cd3813ba02880397b322c82f48aa.png?1445622137'}]",https://d1qb2nb5cznatu.cloudfront.net/startups/i/887184-799674522cd0f258a2649879eb465f0e-medium_jpg.jpg?buster=1445621873,http://www.facebook.com/staceyandmom,,,,"[{'id': 1653, 'angellist_url': 'https://angel.co/los-angeles', 'display_name': 'Los Angeles', 'name': 'los angeles', 'tag_type': 'LocationTag'}]",4,,Mindful Food,2015-10-23T17:49:49Z,False,"[{'id': 141150, 'angellist_url': 'https://angel.co/food-processing-1', 'display_name': 'Food Processing ', 'name': 'Food processing ', 'tag_type': 'CompanyTypeTag'}, {'id': 143018, 'angellist_url': 'https://angel.co/wholesale-3', 'display_name': 'Wholesale', 'name': 'wholesale', 'tag_type': 'CompanyTypeTag'}]","[{'id': 32, 'angellist_url': 'https://angel.co/retail', 'display_name': 'Retail', 'name': 'retail', 'tag_type': 'MarketTag'}, {'id': 72, 'angellist_url': 'https://angel.co/food-and-beverages', 'display_name': 'Food and Beverages', 'name': 'food and beverages', 'tag_type': 'MarketTag'}]",,,1,2015-10-23T17:37:59Z,,,https://d1qb2nb5cznatu.cloudfront.net/startups/i/887184-799674522cd0f258a2649879eb465f0e-thumb_jpg.jpg?buster=1445621873,"A VEGAN, NON GMO, HEALTHY KOREAN FOOD version of Amy's Kitchen.","{'intro': {'has': False, 'can': False}}"
