id,hidden,angellist_url,product_desc,screenshots,logo_url,company_url,video_url,company_size,facebook_url,locations,quality,linkedin_url,name,updated_at,community_profile,company_type,markets,twitter_url,crunchbase_url,follower_count,created_at,blog_url,status,thumb_url,high_concept,abilities
882507,False,https://angel.co/14x-innovation-group,"14x Innovation Group is an innovation development practice that specializes in building innovation capabilities in individuals and organizations in business, government, and education through workshops, consulting sessions, and keynote speeches. 14x Innovation Group helps organizations and individuals innovate by (1) providing a framework for organizational innovation and change and (2) helping individuals leverage the impact of the brain on individual performance.","[{'thumb': 'https://d2gn4xht817m0g.cloudfront.net/p/product_screenshots/images/thumb/000/604/568/604568-2ae864305394dbd388b9b4d03997adc87052ba9d.jpg?1445334980', 'original': 'https://d2gn4xht817m0g.cloudfront.net/p/product_screenshots/images/original/000/604/568/604568-dbd866e51c148781276921d8f91492c3ce195c3f.jpg?1445334980'}]",https://d1qb2nb5cznatu.cloudfront.net/startups/i/882507-c6986c1f8202f08adc60e911645bfbbe-medium_jpg.jpg?buster=1445334823,http://www.pedrodeabreu.com,,,,"[{'id': 2390, 'angellist_url': 'https://angel.co/cambridge-ma', 'display_name': 'Cambridge, MA', 'name': 'cambridge, ma', 'tag_type': 'LocationTag'}]",4,,14x Innovation Group,2015-10-20T09:57:48Z,False,[],"[{'id': 45, 'angellist_url': 'https://angel.co/business-services', 'display_name': 'Business Services', 'name': 'business services', 'tag_type': 'MarketTag'}, {'id': 2806, 'angellist_url': 'https://angel.co/corporate-training', 'display_name': 'Corporate Training', 'name': 'corporate training', 'tag_type': 'MarketTag'}, {'id': 151445, 'angellist_url': 'https://angel.co/consulting-services-1', 'display_name': 'Consulting Services', 'name': 'consulting services', 'tag_type': 'MarketTag'}]",,,1,2015-10-20T09:53:48Z,,,https://d1qb2nb5cznatu.cloudfront.net/startups/i/882507-c6986c1f8202f08adc60e911645bfbbe-thumb_jpg.jpg?buster=1445334823,Igniting brain innovation.,"{'intro': {'has': False, 'can': False}}"
885365,False,https://angel.co/35mmla-1,Commercials,[],https://d1qb2nb5cznatu.cloudfront.net/startups/i/885365-e44b05d8ce80b80583d67458d87cde39-medium_jpg.jpg?buster=1445488037,http://dev.35mm.la,,1-10,,"[{'id': 1653, 'angellist_url': 'https://angel.co/los-angeles', 'display_name': 'Los Angeles', 'name': 'los angeles', 'tag_type': 'LocationTag'}]",1,,35MMLA,2015-10-22T04:27:22Z,False,[],"[{'id': 3127, 'angellist_url': 'https://angel.co/web-development', 'display_name': 'Web Development', 'name': 'web development', 'tag_type': 'MarketTag'}]",,,1,2015-10-22T04:27:22Z,,,https://d1qb2nb5cznatu.cloudfront.net/startups/i/885365-e44b05d8ce80b80583d67458d87cde39-thumb_jpg.jpg?buster=1445488037,Start Up Production Company,"{'intro': {'has': False, 'can': False}}"
883872,False,https://angel.co/7sensors-1,7sensors Verba creates a fully automated environment with ideal conditions for growing various plants in soil without human involvement. Verba is highly energy efficient and allows fully growing 100% organic plants from a seed to mature plant stage.,"[{'thumb': 'https://d2gn4xht817m0g.cloudfront.net/p/product_screenshots/images/thumb/000/606/119/606119-3e71c8bf783eb87a3085e1d2ddcfc8a358584cc6.jpg?1445589472', 'original': 'https://d2gn4xht817m0g.cloudfront.net/p/product_screenshots/images/original/000/606/119/606119-ca4ddd2c466b5645b5559aa0d5cb371bf5cf7f99.jpg?1445589472'}]",https://d1qb2nb5cznatu.cloudfront.net/startups/i/883872-ce19b3df906426f1c32987e3f387646f-medium_jpg.jpg?buster=1445405751,http://www.7sensors.com,,1-10,,"[{'id': 1701, 'angellist_url': 'https://angel.co/mountain-view-1', 'display_name': 'Mountain View', 'name': 'mountain view', 'tag_type': 'LocationTag'}]",3,,7sensors,2015-10-23T08:43:41Z,False,[],"[{'id': 702, 'angellist_url': 'https://angel.co/agriculture', 'display_name': 'Agriculture', 'name': 'agriculture', 'tag_type': 'MarketTag'}, {'id': 2637, 'angellist_url': 'https://angel.co/organic-food', 'display_name': 'Organic Food', 'name': 'organic food', 'tag_type': 'MarketTag'}, {'id': 153894, 'angellist_url': 'https://angel.co/consumer-3', 'display_name': 'Consumer ', 'name': 'Consumer ', 'tag_type': 'MarketTag'}, {'id': 168999, 'angellist_url': 'https://angel.co/marijuana', 'display_name': 'Marijuana', 'name': 'marijuana', 'tag_type': 'MarketTag'}]",,,4,2015-10-21T05:35:56Z,,,https://d1qb2nb5cznatu.cloudfront.net/startups/i/883872-ce19b3df906426f1c32987e3f387646f-thumb_jpg.jpg?buster=1445405751,Grow the plants you want without any involvement,"{'intro': {'has': False, 'can': False}}"
886383,False,https://angel.co/aurfy-inc-nihaopay,,[],https://d1qb2nb5cznatu.cloudfront.net/startups/i/886383-0ecbf2abb4afdd87c92bc11e1004fc33-medium_jpg.jpg?buster=1445555158,http://www.nihaopay.com,https://vimeo.com/134865641,1-10,,"[{'id': 1703, 'angellist_url': 'https://angel.co/sunnyvale', 'display_name': 'Sunnyvale', 'name': 'sunnyvale', 'tag_type': 'LocationTag'}]",1,,Aurfy Inc./NihaoPay,2015-10-22T23:21:06Z,False,[],"[{'id': 17, 'angellist_url': 'https://angel.co/financial-services-1', 'display_name': 'Financial Services', 'name': 'financial services', 'tag_type': 'MarketTag'}, {'id': 71, 'angellist_url': 'https://angel.co/payments', 'display_name': 'Payments', 'name': 'payments', 'tag_type': 'MarketTag'}, {'id': 1468, 'angellist_url': 'https://angel.co/banking-2', 'display_name': 'Banking', 'name': 'banking', 'tag_type': 'MarketTag'}, {'id': 154663, 'angellist_url': 'https://angel.co/payment-systems', 'display_name': 'Payment Systems', 'name': 'Payment systems', 'tag_type': 'MarketTag'}]",,,1,2015-10-22T23:06:04Z,,,https://d1qb2nb5cznatu.cloudfront.net/startups/i/886383-0ecbf2abb4afdd87c92bc11e1004fc33-thumb_jpg.jpg?buster=1445555158,"Global Acquirer for UnionPay, WechatPay, and Alipay","{'intro': {'has': False, 'can': False}}"
887887,False,https://angel.co/n-a-155,,[],https://d1qb2nb5cznatu.cloudfront.net/startups/i/887887-6f58dcb23cb3ab337c258445b7417529-medium_jpg.jpg?buster=1445697301,http://www.dontwanttodisclose.com,,1-10,,"[{'id': 1664, 'angellist_url': 'https://angel.co/new-york-ny-1', 'display_name': 'New York City', 'name': 'new york, ny', 'tag_type': 'LocationTag'}]",3,,N/A,2015-10-24T14:35:06Z,False,[],"[{'id': 3, 'angellist_url': 'https://angel.co/mobile-2', 'display_name': 'Mobile', 'name': 'mobile', 'tag_type': 'MarketTag'}]",,,1,2015-10-24T14:35:06Z,,,https://d1qb2nb5cznatu.cloudfront.net/startups/i/887887-6f58dcb23cb3ab337c258445b7417529-thumb_jpg.jpg?buster=1445697301,will only say pitch to those we reach out to,"{'intro': {'has': False, 'can': False}}"
886426,False,https://angel.co/a-garden-of-fragrance,"Real perfumes from France. Real perfume is costly, so my customers are pampered women with disposable income.",[],https://d1qb2nb5cznatu.cloudfront.net/startups/i/886426-b9bb1c41aed261e64dab31ecddc90a26-medium_jpg.jpg?buster=1445558463,http://www.agardenoffragrance.com,,1-10,,"[{'id': 2680, 'angellist_url': 'https://angel.co/kansas-city-mo', 'display_name': 'Kansas City, MO', 'name': 'kansas city, mo', 'tag_type': 'LocationTag'}]",3,,A Garden of Fragrance,2015-10-23T00:02:22Z,False,[],"[{'id': 29, 'angellist_url': 'https://angel.co/e-commerce', 'display_name': 'E-Commerce', 'name': 'e-commerce', 'tag_type': 'MarketTag'}, {'id': 418, 'angellist_url': 'https://angel.co/personal-health', 'display_name': 'Personal Health', 'name': 'personal health', 'tag_type': 'MarketTag'}, {'id': 435, 'angellist_url': 'https://angel.co/beauty', 'display_name': 'Beauty', 'name': 'beauty', 'tag_type': 'MarketTag'}, {'id': 151101, 'angellist_url': 'https://angel.co/france-3', 'display_name': 'France', 'name': 'France', 'tag_type': 'MarketTag'}]",,,1,2015-10-22T23:55:51Z,,,https://d1qb2nb5cznatu.cloudfront.net/startups/i/886426-b9bb1c41aed261e64dab31ecddc90a26-thumb_jpg.jpg?buster=1445558463,French perfumes,"{'intro': {'has': False, 'can': False}}"
885231,False,https://angel.co/a-level-capital,"We exist so that brilliant ideas don't go to waste. 

Students in the greater DC/Baltimore area are teeming with untapped potential. These students fully have the ability to grow their brilliant ideas into billion dollar companies, they just need a little bit of help to get started. A-Level Capital is the solution.

At A-Level Capital, our goal is to help a startup move through the first phase of its life with ease. With A-Level, a startup will have the ability to leverage our capital, talent, and skills to grow its company to the point where it can move on to attract funding on a larger scale. In addition, a new startup will have access to our wide network of connections, skills and mentors.",[],https://d1qb2nb5cznatu.cloudfront.net/startups/i/885231-31ec097c552d9168c58c8a7a5d933ea2-medium_jpg.jpg?buster=1445479979,http://www.alevelcapital.com,,,,"[{'id': 1619, 'angellist_url': 'https://angel.co/baltimore', 'display_name': 'Baltimore', 'name': 'baltimore', 'tag_type': 'LocationTag'}]",6,,A-Level Capital,2015-10-22T03:05:07Z,False,[],"[{'id': 3, 'angellist_url': 'https://angel.co/mobile-2', 'display_name': 'Mobile', 'name': 'mobile', 'tag_type': 'MarketTag'}, {'id': 12, 'angellist_url': 'https://angel.co/enterprise-software', 'display_name': 'Enterprise Software', 'name': 'enterprise software', 'tag_type': 'MarketTag'}, {'id': 92, 'angellist_url': 'https://angel.co/machine-learning', 'display_name': 'Machine Learning', 'name': 'machine learning', 'tag_type': 'MarketTag'}, {'id': 175, 'angellist_url': 'https://angel.co/health-care-information-technology', 'display_name': 'Health Care Information Technology', 'name': 'health care information technology', 'tag_type': 'MarketTag'}]",,,25,2015-10-22T02:13:03Z,,,https://d1qb2nb5cznatu.cloudfront.net/startups/i/885231-31ec097c552d9168c58c8a7a5d933ea2-thumb_jpg.jpg?buster=1445479979,Student-led Venture Capital Firm,"{'intro': {'has': False, 'can': False}}"
886702,False,https://angel.co/abc-locksmith-clearwater-1,"ABOUT:
If you have problems with your door lock, you can call to us immediately. We are open 24 hours.			
			
ABC Locksmith’s services are ultra reliable and highly recommended. All of our services are made to protect your vehicle, business and home. Choosing the services of our company will give you a free and secured safeguards.  

								
CONTACT INFORMATION:
530 Park St Clearwater, Florida 33756
(813) 336-5199
manager@abclocksmith.org

Hours of Operation: 24/7",[],https://d1qb2nb5cznatu.cloudfront.net/startups/i/886702-36e1f303f3cf9bdc169cbaa5e1484112-medium_jpg.jpg?buster=1445583783,http://www.abclocksmith.org/,,,,"[{'id': 1699, 'angellist_url': 'https://angel.co/florida', 'display_name': 'Florida', 'name': 'florida', 'tag_type': 'LocationTag'}]",1,,ABC Locksmith Clearwater,2015-10-23T07:04:21Z,False,[],"[{'id': 249, 'angellist_url': 'https://angel.co/services', 'display_name': 'Services', 'name': 'services', 'tag_type': 'MarketTag'}]",,,1,2015-10-23T07:03:08Z,,,https://d1qb2nb5cznatu.cloudfront.net/startups/i/886702-36e1f303f3cf9bdc169cbaa5e1484112-thumb_jpg.jpg?buster=1445583783,Clearwater Locksmith Services,"{'intro': {'has': False, 'can': False}}"
887806,False,https://angel.co/abera-bv,,[],https://d1qb2nb5cznatu.cloudfront.net/startups/i/887806-2e1f0bda428205ef265db981af1c1a69-medium_jpg.jpg?buster=1445687118,http://nyabera.biz,,11-50,,"[{'id': 1664, 'angellist_url': 'https://angel.co/new-york-ny-1', 'display_name': 'New York City', 'name': 'new york, ny', 'tag_type': 'LocationTag'}]",1,,Abera BV,2015-10-24T11:48:40Z,False,[],"[{'id': 29, 'angellist_url': 'https://angel.co/e-commerce', 'display_name': 'E-Commerce', 'name': 'e-commerce', 'tag_type': 'MarketTag'}]",,,1,2015-10-24T11:45:22Z,,,https://d1qb2nb5cznatu.cloudfront.net/startups/i/887806-2e1f0bda428205ef265db981af1c1a69-thumb_jpg.jpg?buster=1445687118,logistics,"{'intro': {'has': False, 'can': False}}"
882849,False,https://angel.co/ac-squared,"The ultimate goal of the AC-Squared software is to become the premier program that all Orthotics & Prosthetics companies use.  This software will be able to handle all the billing, scheduling, ordering, and management of patient information in the workplace.  We will help lower cost to the distributor and manufacture which will cascade down to the consumer then finally the patient.  We wish to create a cost-effective program that is efficient for the everyday technician and owner.  Simplifying certain processes in their daily routine will allow for less opportunities to create mistakes.  This software will work with distributors and manufactures by allowing the client to purchase materials from them within the software itself.",[],https://d1qb2nb5cznatu.cloudfront.net/startups/i/882849-1aab8a74e4427a369d4429b5fc6b0f68-medium_jpg.jpg?buster=1445354921,http://www.ac-squared.com,,,,"[{'id': 1846, 'angellist_url': 'https://angel.co/kentucky', 'display_name': 'Kentucky', 'name': 'kentucky', 'tag_type': 'LocationTag'}]",3,,AC-Squared,2015-10-20T15:28:47Z,False,[],"[{'id': 13, 'angellist_url': 'https://angel.co/health-care', 'display_name': 'Health Care', 'name': 'health care', 'tag_type': 'MarketTag'}, {'id': 175, 'angellist_url': 'https://angel.co/health-care-information-technology', 'display_name': 'Health Care Information Technology', 'name': 'health care information technology', 'tag_type': 'MarketTag'}, {'id': 841, 'angellist_url': 'https://angel.co/software', 'display_name': 'Software', 'name': 'software', 'tag_type': 'MarketTag'}, {'id': 111311, 'angellist_url': 'https://angel.co/electronic-health-records-1', 'display_name': 'Electronic Health Records', 'name': 'electronic health records', 'tag_type': 'MarketTag'}]",,,1,2015-10-20T15:28:47Z,,,https://d1qb2nb5cznatu.cloudfront.net/startups/i/882849-1aab8a74e4427a369d4429b5fc6b0f68-thumb_jpg.jpg?buster=1445354921,Healthcare Electronic Medical Records Software,"{'intro': {'has': False, 'can': False}}"
889358,False,https://angel.co/admitopia,"Thousands of people will apply to the college of your choice, responding to the same old essay prompts and submitting the same old materials. Don't you wish there was a way to stand out from the crowd? Admitopia lets you submit a profile that will be viewed by admissions offices across the country, letting you create a dynamic portrait that gives you an edge over the competition.",[],https://d1qb2nb5cznatu.cloudfront.net/startups/i/889358-7022b7c766c010f89ffbaf5db7057f01-medium_jpg.jpg?buster=1445850580,http://www.Admitopia.com,https://www.youtube.com/watch?v=W8irk3Lq6fs,,,"[{'id': 1664, 'angellist_url': 'https://angel.co/new-york-ny-1', 'display_name': 'New York City', 'name': 'new york, ny', 'tag_type': 'LocationTag'}]",1,,Admitopia,2015-10-26T09:13:59Z,False,[],"[{'id': 43, 'angellist_url': 'https://angel.co/education', 'display_name': 'Education', 'name': 'education', 'tag_type': 'MarketTag'}]",,,1,2015-10-26T09:09:45Z,,,https://d1qb2nb5cznatu.cloudfront.net/startups/i/889358-7022b7c766c010f89ffbaf5db7057f01-thumb_jpg.jpg?buster=1445850580,,"{'intro': {'has': False, 'can': False}}"
884578,False,https://angel.co/aesthetic-dentistry-of-arrowhead,"Choosing the proper person to care for the dental health of your family take careful consideration. A genuine concern for patients combined with clinical experience is the trademark of a good dentist. At Aesthetic Dentistry of Arrowhead, our Glendale office is devoted to both family and general dentistry, with an emphasis in cosmetic dentistry. As your primary oral care provider, Dr Greg Ceyhan and his staff are responsible for diagnosis, management and treatment of a range of disorders, diseases, and conditions that can affect your jaw, gums, teeth, and face, as well as providing top of the line cosmetic procedures to help you look and feel your best. We coordinate many services related to dental needs for our Glendale, Phoenix, and Peoria patients of all ages so your entire family can visit our practice.",[],https://d1qb2nb5cznatu.cloudfront.net/startups/i/884578-c26bfde96e3393c370d4ea27e18b3bcb-medium_jpg.jpg?buster=1445448501,http://www.drgregceyhan.com,https://www.youtube.com/watch?v=T6RlGHZ5Cdk,,https://www.facebook.com/CeyhanDental,"[{'id': 8794, 'angellist_url': 'https://angel.co/glendale', 'display_name': 'Glendale', 'name': 'glendale', 'tag_type': 'LocationTag'}]",1,http://www.linkedin.com/company/aesthetic-dentistry-of-arrowhead,Aesthetic Dentistry of Arrowhead,2015-10-21T17:48:22Z,False,[],"[{'id': 155237, 'angellist_url': 'https://angel.co/dental-practices', 'display_name': 'Dental Practices', 'name': 'dental practices', 'tag_type': 'MarketTag'}]",https://twitter.com/CeyhanDental,,1,2015-10-21T17:28:25Z,http://www.drgregceyhan.com/blog,,https://d1qb2nb5cznatu.cloudfront.net/startups/i/884578-c26bfde96e3393c370d4ea27e18b3bcb-thumb_jpg.jpg?buster=1445448501,"Cosmetic Dentist Serving Peoria, AZ","{'intro': {'has': False, 'can': False}}"
884584,False,https://angel.co/aging-health,Ah lets the patient connect with providers. For free. On their TV. It's as easy as changing the channel,[],https://d1qb2nb5cznatu.cloudfront.net/startups/i/884584-21f3ff3592f2509837c00ba3f9793b87-medium_jpg.jpg?buster=1445448580,http://www.idkyet.org,,,,"[{'id': 2425, 'angellist_url': 'https://angel.co/richmond', 'display_name': 'Richmond', 'name': 'richmond', 'tag_type': 'LocationTag'}]",3,,Aging Health,2015-10-21T17:29:45Z,False,[],"[{'id': 4, 'angellist_url': 'https://angel.co/digital-media', 'display_name': 'Digital Media', 'name': 'digital media', 'tag_type': 'MarketTag'}, {'id': 13, 'angellist_url': 'https://angel.co/health-care', 'display_name': 'Health Care', 'name': 'health care', 'tag_type': 'MarketTag'}, {'id': 49, 'angellist_url': 'https://angel.co/telecommunications', 'display_name': 'Telecommunications', 'name': 'telecommunications', 'tag_type': 'MarketTag'}]",,,1,2015-10-21T17:29:45Z,,,https://d1qb2nb5cznatu.cloudfront.net/startups/i/884584-21f3ff3592f2509837c00ba3f9793b87-thumb_jpg.jpg?buster=1445448580,"Interoperability with EMRs, patient tracking and home health services.","{'intro': {'has': False, 'can': False}}"
883654,False,https://angel.co/aivibe,"We  are building an app called Ellie that will match people with the best experience, saving them time and eliminating uncertainty. Using Ai and Big Data, we understand which experiences will be better suited to an individual’s personality, preferences, as well as account for other factors that can influence their experience - in real time.","[{'thumb': 'https://d2gn4xht817m0g.cloudfront.net/p/product_screenshots/images/thumb/000/607/561/607561-96d24c31a4902c0ee18bafc0c360bdef7ee88c44.jpg?1445911133', 'original': 'https://d2gn4xht817m0g.cloudfront.net/p/product_screenshots/images/original/000/607/561/607561-7b518536498edba3cab87ecc8b0e357954e590c4.png?1445911133'}]",https://d1qb2nb5cznatu.cloudfront.net/startups/i/883654-a69486bea66b5949945c7db742f148e0-medium_jpg.jpg?buster=1445388293,http://aivibe.com,,,,"[{'id': 1692, 'angellist_url': 'https://angel.co/san-francisco', 'display_name': 'San Francisco', 'name': 'san francisco', 'tag_type': 'LocationTag'}]",3,,Aivibe,2015-10-26T23:17:42Z,False,[],"[{'id': 34, 'angellist_url': 'https://angel.co/advertising', 'display_name': 'Advertising', 'name': 'advertising', 'tag_type': 'MarketTag'}, {'id': 200, 'angellist_url': 'https://angel.co/artificial-intelligence', 'display_name': 'Artificial Intelligence', 'name': 'artificial intelligence', 'tag_type': 'MarketTag'}, {'id': 408, 'angellist_url': 'https://angel.co/ios', 'display_name': 'iOS', 'name': 'ios', 'tag_type': 'MarketTag'}, {'id': 2812, 'angellist_url': 'https://angel.co/entertainment-industry', 'display_name': 'Entertainment Industry', 'name': 'entertainment industry', 'tag_type': 'MarketTag'}]",,,2,2015-10-21T00:44:58Z,,,https://d1qb2nb5cznatu.cloudfront.net/startups/i/883654-a69486bea66b5949945c7db742f148e0-thumb_jpg.jpg?buster=1445388293,Entertainment expert AI,"{'intro': {'has': False, 'can': False}}"
884818,False,https://angel.co/alike-1,"ALIKE is a new generation of social platform for mobile that allows you to create real time profile based on keywords. Use this app to locate users by specific tags or post your own to be found by others. Create multiple and continuous searches and get notifications on them entering proximity!

With the internet going mobile, searches change nature. ALIKE as a keyword driven, real time proximity based search platform is the Swiss army knife for interacting with keywords on mobile. Welcome into the future of Social - based on real time matching, clustering and cross referencing of keywords!

Use this app to: find the closest helping hand in the community and recycle resources, real time group collaborations with live video and file sharing, reconnect with the soulmate in a new place or as a disaster relief tool.

ALIKE as a platform for dynamic tag-geofencing and will become a natural extension into the future of consumer interactions with iBeacons and IoT devices.","[{'thumb': 'https://d2gn4xht817m0g.cloudfront.net/p/product_screenshots/images/thumb/000/605/727/605727-5131ebb3b672a07cf359797ab6d3a00de72084ab.jpg?1445525163', 'original': 'https://d2gn4xht817m0g.cloudfront.net/p/product_screenshots/images/original/000/605/727/605727-20735ebba920716a46f38534f60906077952c990.jpg?1445525163'}, {'thumb': 'https://d2gn4xht817m0g.cloudfront.net/p/product_screenshots/images/thumb/000/605/728/605728-6a64dea0ae316402b6b991a42188686d0e08b25d.jpg?1445525197', 'original': 'https://d2gn4xht817m0g.cloudfront.net/p/product_screenshots/images/original/000/605/728/605728-5530efd2cbbf405277811411ca22d1e78199623d.jpg?1445525197'}, {'thumb': 'https://d2gn4xht817m0g.cloudfront.net/p/product_screenshots/images/thumb/000/605/729/605729-00d526f5842189f5ed9c09b8960edec627eb6d83.jpg?1445525226', 'original': 'https://d2gn4xht817m0g.cloudfront.net/p/product_screenshots/images/original/000/605/729/605729-b98b4604d2388c2ffda546b40962883b375c3d5b.jpg?1445525226'}, {'thumb': 'https://d2gn4xht817m0g.cloudfront.net/p/product_screenshots/images/thumb/000/605/730/605730-eb8af4347adf717612fa1bae4594aa4d90bac3ea.jpg?1445525265', 'original': 'https://d2gn4xht817m0g.cloudfront.net/p/product_screenshots/images/original/000/605/730/605730-5c7b23ba7cb3a1c4f98a7bb72e5b3dfe997e0a9f.jpg?1445525265'}, {'thumb': 'https://d2gn4xht817m0g.cloudfront.net/p/product_screenshots/images/thumb/000/605/731/605731-9fe9c7fcbf2d05bc675d32739d20011fd4ede37a.jpg?1445525295', 'original': 'https://d2gn4xht817m0g.cloudfront.net/p/product_screenshots/images/original/000/605/731/605731-10a1a2cf1572787fa2b8798f1b5e072470d2341c.jpg?1445525295'}, {'thumb': 'https://d2gn4xht817m0g.cloudfront.net/p/product_screenshots/images/thumb/000/605/732/605732-3dbc7a1d02557329083e2197638ccca4298d38d5.jpg?1445525514', 'original': 'https://d2gn4xht817m0g.cloudfront.net/p/product_screenshots/images/original/000/605/732/605732-2d7068f1e42026818d18d91e41f9c035b0ecf790.png?1445525514'}]",https://d1qb2nb5cznatu.cloudfront.net/startups/i/884818-b671b750b7561b867d8eb52e798a3f76-medium_jpg.jpg?buster=1445457558,http://www.alike.net,https://www.youtube.com/watch?v=JNnsONfs1KY&feature=youtu.be#https://www.youtube.com/watch?v=JNnsONfs1KY&feature=youtu.be,1-10,,"[{'id': 1692, 'angellist_url': 'https://angel.co/san-francisco', 'display_name': 'San Francisco', 'name': 'san francisco', 'tag_type': 'LocationTag'}]",5,,ALIKE - Search iT by Proximity!,2015-10-24T19:06:46Z,False,[],"[{'id': 3, 'angellist_url': 'https://angel.co/mobile-2', 'display_name': 'Mobile', 'name': 'mobile', 'tag_type': 'MarketTag'}, {'id': 57, 'angellist_url': 'https://angel.co/location-based-services', 'display_name': 'Location Based Services', 'name': 'location based services', 'tag_type': 'MarketTag'}, {'id': 162, 'angellist_url': 'https://angel.co/marketplaces', 'display_name': 'Marketplaces', 'name': 'marketplaces', 'tag_type': 'MarketTag'}, {'id': 269, 'angellist_url': 'https://angel.co/social-media-platforms', 'display_name': 'Social Media Platforms', 'name': 'social media platforms', 'tag_type': 'MarketTag'}]",,,3,2015-10-21T19:59:23Z,,,https://d1qb2nb5cznatu.cloudfront.net/startups/i/884818-b671b750b7561b867d8eb52e798a3f76-thumb_jpg.jpg?buster=1445457558,"Real time matching, clustering and cross referencing of users by keywords.","{'intro': {'has': False, 'can': False}}"
888784,False,https://angel.co/alvarado-turner,"Alvarado & Turner Inc. pride ourselves on the idea to make the businesses that are already in the community better. Most unsuccessful or failing businesses are in that current circumstance because they spend more time in productions and operations, rather developing a good system so that most of the owners time should be invested in marketing and getting new clients. With our team of professionals who are experts in business ownership, marketing, management, etc. we would buy these businesses, improve them, keep them for a long term profit, and continue the process.",[],https://d1qb2nb5cznatu.cloudfront.net/startups/i/888784-0d40707fc5778c99ba316e1ac9b84ca5-medium_jpg.jpg?buster=1445806776,http://www.alvarado&turner.com,,,,"[{'id': 1679, 'angellist_url': 'https://angel.co/san-diego', 'display_name': 'San Diego', 'name': 'san diego', 'tag_type': 'LocationTag'}]",3,,Alvarado & Turner ,2015-10-25T20:59:50Z,False,[],"[{'id': 321, 'angellist_url': 'https://angel.co/finance', 'display_name': 'Finance', 'name': 'finance', 'tag_type': 'MarketTag'}]",,,1,2015-10-25T19:51:01Z,,,https://d1qb2nb5cznatu.cloudfront.net/startups/i/888784-0d40707fc5778c99ba316e1ac9b84ca5-thumb_jpg.jpg?buster=1445806776,Keeping Businesses in Business,"{'intro': {'has': False, 'can': False}}"
