id,hidden,angellist_url,product_desc,screenshots,logo_url,company_url,video_url,company_size,facebook_url,locations,quality,linkedin_url,name,updated_at,community_profile,company_type,markets,twitter_url,crunchbase_url,follower_count,created_at,blog_url,status,thumb_url,high_concept,abilities
886480,False,https://angel.co/rising-barn,"Our first product is a one-or-two room unit that will help families in dense environments create more space for work or recreation.  Our product is sustainable and architecturally designed. It is the only one on the market to be airtight, insulated, and complete- inside and out. Plus, it arrives flat-packed and is do-it-yourself ready.","[{'thumb': 'https://d2gn4xht817m0g.cloudfront.net/p/product_screenshots/images/thumb/000/606/325/606325-aa8f26bb85af5f5a4d56e9f3dd962ed994ed3bba.jpg?1445622354', 'original': 'https://d2gn4xht817m0g.cloudfront.net/p/product_screenshots/images/original/000/606/325/606325-8e95efb0b4f32091d0d604dd514450b410463aca.jpg?1445622354'}]",https://d1qb2nb5cznatu.cloudfront.net/startups/i/886480-63047100e86478b4c2aefa3a4aa3a098-medium_jpg.jpg?buster=1445569182,http://risingbarn.com,,,,"[{'id': 1617, 'angellist_url': 'https://angel.co/austin', 'display_name': 'Austin', 'name': 'austin', 'tag_type': 'LocationTag'}]",5,,Rising Barn,2015-10-26T13:52:38Z,False,[],"[{'id': 16, 'angellist_url': 'https://angel.co/real-estate-1', 'display_name': 'Real Estate', 'name': 'real estate', 'tag_type': 'MarketTag'}, {'id': 31, 'angellist_url': 'https://angel.co/consumer-goods', 'display_name': 'Consumer Goods', 'name': 'consumer goods', 'tag_type': 'MarketTag'}, {'id': 32, 'angellist_url': 'https://angel.co/retail', 'display_name': 'Retail', 'name': 'retail', 'tag_type': 'MarketTag'}, {'id': 94, 'angellist_url': 'https://angel.co/mobile-commerce-1', 'display_name': 'Mobile Commerce', 'name': 'mobile commerce', 'tag_type': 'MarketTag'}]",,,8,2015-10-23T01:32:12Z,,,https://d1qb2nb5cznatu.cloudfront.net/startups/i/886480-63047100e86478b4c2aefa3a4aa3a098-thumb_jpg.jpg?buster=1445569182,Innovative building kits for doers. Our kits last a lifetime and are easy to build.,"{'intro': {'has': False, 'can': False}}"
883361,False,https://angel.co/roadgazer,"Roadgazer is intelligent assistant, that helps to plan and manage the car trips - it creates the itinerary with stops to see, eat and rest, educates on the surroundings, tracks the trip schedule, helps to resolve in-trip logistic issues - all on the go, interactive, by voice.

There are 1BN roadtrips done per year in US only. Bringing run-time A.I. Trip Assistant to car travelers means whole paradigm switch of how car trips are done: from long hours web-based tedious pre-planning and then struggling on the go with broken plans, to fast on-the go trip management right in the car. With, correspondingly, revenue flow toward in-car on-the-go solution from the “places” web apps.

With smartphones becoming central hub of connected cars, it makes a good fit for Roadgazer to become integrated solution for the Car Infotainment systems, so for the user ability to plan and manage the trip would be organically connected with the car itself.",[],https://d1qb2nb5cznatu.cloudfront.net/startups/i/883361-637fb5e001a32df0994ce4a17d57445f-medium_jpg.jpg?buster=1445373813,http://roadgazer.com,,,,"[{'id': 1703, 'angellist_url': 'https://angel.co/sunnyvale', 'display_name': 'Sunnyvale', 'name': 'sunnyvale', 'tag_type': 'LocationTag'}]",3,,Roadgazer,2015-10-20T20:43:38Z,False,[],"[{'id': 69, 'angellist_url': 'https://angel.co/automotive', 'display_name': 'Automotive', 'name': 'automotive', 'tag_type': 'MarketTag'}, {'id': 9100, 'angellist_url': 'https://angel.co/travel-tourism', 'display_name': 'Travel & Tourism', 'name': 'travel & tourism', 'tag_type': 'MarketTag'}, {'id': 152288, 'angellist_url': 'https://angel.co/connected-cars', 'display_name': 'Connected Cars', 'name': 'Connected Cars', 'tag_type': 'MarketTag'}]",,,1,2015-10-20T20:43:38Z,,,https://d1qb2nb5cznatu.cloudfront.net/startups/i/883361-637fb5e001a32df0994ce4a17d57445f-thumb_jpg.jpg?buster=1445373813,Artificial Intelligence Assistant for Car Trips,"{'intro': {'has': False, 'can': False}}"
885956,False,https://angel.co/roca-partners,,[],https://d1qb2nb5cznatu.cloudfront.net/startups/i/885956-bba83dbb0a4a7c129b526f2b95e3dfe9-medium_jpg.jpg?buster=1445535346,http://www.rocapartners.com,,1-10,,"[{'id': 1653, 'angellist_url': 'https://angel.co/los-angeles', 'display_name': 'Los Angeles', 'name': 'los angeles', 'tag_type': 'LocationTag'}]",6,,ROCA Partners,2015-10-22T17:35:50Z,False,"[{'id': 146034, 'angellist_url': 'https://angel.co/investment-firm', 'display_name': 'Investment Firm', 'name': 'investment firm', 'tag_type': 'CompanyTypeTag'}]","[{'id': 17, 'angellist_url': 'https://angel.co/financial-services-1', 'display_name': 'Financial Services', 'name': 'financial services', 'tag_type': 'MarketTag'}, {'id': 1161, 'angellist_url': 'https://angel.co/travel-1', 'display_name': 'Travel', 'name': 'travel', 'tag_type': 'MarketTag'}, {'id': 9826, 'angellist_url': 'https://angel.co/healthcare-services', 'display_name': 'Healthcare Services', 'name': 'healthcare services', 'tag_type': 'MarketTag'}, {'id': 153894, 'angellist_url': 'https://angel.co/consumer-3', 'display_name': 'Consumer ', 'name': 'Consumer ', 'tag_type': 'MarketTag'}]",,,1,2015-10-22T17:00:58Z,,,https://d1qb2nb5cznatu.cloudfront.net/startups/i/885956-bba83dbb0a4a7c129b526f2b95e3dfe9-thumb_jpg.jpg?buster=1445535346,Consumer services private equity firm,"{'intro': {'has': False, 'can': False}}"
886592,False,https://angel.co/rofneck-1,"Target
- Working Professionals
- Givers
- Matchers
- Takers

Problem
There is no online median for professionals to (1) grow these inner circles based on a mutually beneficial network all striving to help each other; (2) shorten the timeline of reaching success and (3) measure the networking process to achieve returnable results.

Changing the World
Rofneck will change the way people, society and the individual think by rewarding those with altruistic behavior.",[],https://d1qb2nb5cznatu.cloudfront.net/startups/i/886592-bd43e2060b2bc0f935cb002e56ccd629-medium_jpg.jpg?buster=1445573846,http://www.rofneck.com,,1-10,,"[{'id': 1691, 'angellist_url': 'https://angel.co/washington-dc', 'display_name': 'Washington, DC', 'name': 'washington, dc', 'tag_type': 'LocationTag'}]",3,,Rofneck,2015-10-23T04:17:31Z,False,[],"[{'id': 1, 'angellist_url': 'https://angel.co/consumer-internet', 'display_name': 'Consumer Internet', 'name': 'consumer internet', 'tag_type': 'MarketTag'}, {'id': 3, 'angellist_url': 'https://angel.co/mobile-2', 'display_name': 'Mobile', 'name': 'mobile', 'tag_type': 'MarketTag'}, {'id': 6, 'angellist_url': 'https://angel.co/social-media', 'display_name': 'Social Media', 'name': 'social media', 'tag_type': 'MarketTag'}, {'id': 269, 'angellist_url': 'https://angel.co/social-media-platforms', 'display_name': 'Social Media Platforms', 'name': 'social media platforms', 'tag_type': 'MarketTag'}, {'id': 1000, 'angellist_url': 'https://angel.co/private-social-networking', 'display_name': 'Private Social Networking', 'name': 'private social networking', 'tag_type': 'MarketTag'}, {'id': 1181, 'angellist_url': 'https://angel.co/professional-networking', 'display_name': 'Professional Networking', 'name': 'professional networking', 'tag_type': 'MarketTag'}, {'id': 156282, 'angellist_url': 'https://angel.co/working-professionals', 'display_name': 'Working Professionals', 'name': 'Working professionals', 'tag_type': 'MarketTag'}]",,,1,2015-10-23T04:17:31Z,,,https://d1qb2nb5cznatu.cloudfront.net/startups/i/886592-bd43e2060b2bc0f935cb002e56ccd629-thumb_jpg.jpg?buster=1445573846,Social Media Power site with a societal structure – a secret society that’s public.,"{'intro': {'has': False, 'can': False}}"
882647,False,https://angel.co/ruff-n-tumble-childcare,"Childcare center 6,000 sf building. Seeking funds to purchase this building and others. 18k  per week potential.  Childcare is always in demand.",[],https://d1qb2nb5cznatu.cloudfront.net/startups/i/882647-23cb387ae12d4a97d97fc48a56c7ee41-medium_jpg.jpg?buster=1445343329,http://www.chidcare.com,,,https://m.facebook.com/profile.php?id=662335327149233&tsid=0.0011929655447602272&source=typeahead,"[{'id': 2377, 'angellist_url': 'https://angel.co/dayton', 'display_name': 'Dayton', 'name': 'dayton', 'tag_type': 'LocationTag'}]",3,,Ruff n tumble childcare ,2015-10-20T12:21:37Z,False,[],"[{'id': 12703, 'angellist_url': 'https://angel.co/child-care', 'display_name': 'Child Care', 'name': 'child care', 'tag_type': 'MarketTag'}]",,,1,2015-10-20T12:08:10Z,,,https://d1qb2nb5cznatu.cloudfront.net/startups/i/882647-23cb387ae12d4a97d97fc48a56c7ee41-thumb_jpg.jpg?buster=1445343329,childcare ,"{'intro': {'has': False, 'can': False}}"
887356,False,https://angel.co/ryvit,"There are over 2,500 applications servicing 1 million businesses that compete in the Construction market.  On average, these businesses use at least 10 applications to run their business, with a central focus to the accounting platform.  Because of this, more than 80% of businesses are demanding integration. 

Ryvit aims to help Vendors solve this problem and disrupt the trends occurring in the application layer of technology by helping Businesses that need integration achieve it.  All of our competition is placing the integration burden on the Businesses themselves, vs. working with the Application Vendors to bring the solutions to the business directly.  Ryvit-enabled Partners will be able to white-label solutions that integrate with the top accounting platforms in their market.  With those solutions in place, our Partners will be able to expand revenue with subscription-based add-on pricing, adding an estimated 20-40% to their top line.",[],https://d1qb2nb5cznatu.cloudfront.net/startups/i/887356-f413d47fc58217281094e19407cbaf6c-medium_jpg.jpg?buster=1445630754,http://ryvit.com/,,,,"[{'id': 304290, 'angellist_url': 'https://angel.co/saint-louis-1', 'display_name': 'Saint Louis', 'name': 'saint louis', 'tag_type': 'LocationTag'}]",3,,Ryvit,2015-10-23T20:06:09Z,False,[],"[{'id': 10, 'angellist_url': 'https://angel.co/saas', 'display_name': 'SaaS', 'name': 'SaaS', 'tag_type': 'MarketTag'}, {'id': 12, 'angellist_url': 'https://angel.co/enterprise-software', 'display_name': 'Enterprise Software', 'name': 'enterprise software', 'tag_type': 'MarketTag'}, {'id': 449, 'angellist_url': 'https://angel.co/application-platforms', 'display_name': 'Application Platforms', 'name': 'application platforms', 'tag_type': 'MarketTag'}, {'id': 841, 'angellist_url': 'https://angel.co/software', 'display_name': 'Software', 'name': 'software', 'tag_type': 'MarketTag'}]",,,1,2015-10-23T20:06:09Z,,,https://d1qb2nb5cznatu.cloudfront.net/startups/i/887356-f413d47fc58217281094e19407cbaf6c-thumb_jpg.jpg?buster=1445630754,Integration Platform as a Service,"{'intro': {'has': False, 'can': False}}"
886021,False,https://angel.co/snl-farming,"The product is to start up a social park that combines a farmer market with a social event. I am an engineer and I just purchased 18 acres in Collin County,TX with access to city water and electricity, however the purchase of the land and utilities leaves me in need of financial investment to finish my project in a timely manner. The end result will brings together an outdoor environment with sales of a wide range of agricultural  and aquaponic products  including fruits, veggies, fish, and poultry. The park will host events such as live music and social events to help people gather and build friendships along with buying their favorite products. I also plan on growing a fruit that is not widely available and with a lot of research it has been very helpful for diabetics. I want to offer it at a much more affordable price than current stores have.  I have a very big project in mind and would love to get in touch with someone that shares an interest in helping this project financially.",[],https://d1qb2nb5cznatu.cloudfront.net/startups/i/886021-768d3156bf3b995cde3237a3aa06bbae-medium_jpg.jpg?buster=1445541142,https://www.linkedin.com/pub/sam-lashgari/82/129/175?trk=pulse-det-athr_prof-art_hdr,,,,"[{'id': 1686, 'angellist_url': 'https://angel.co/texas', 'display_name': 'Texas', 'name': 'texas', 'tag_type': 'LocationTag'}]",3,,S&L Agra,2015-10-22T19:21:58Z,False,[],"[{'id': 702, 'angellist_url': 'https://angel.co/agriculture', 'display_name': 'Agriculture', 'name': 'agriculture', 'tag_type': 'MarketTag'}, {'id': 2446, 'angellist_url': 'https://angel.co/aquaculture', 'display_name': 'Aquaculture', 'name': 'aquaculture', 'tag_type': 'MarketTag'}, {'id': 154394, 'angellist_url': 'https://angel.co/social-3', 'display_name': 'Social', 'name': 'Social', 'tag_type': 'MarketTag'}]",,,1,2015-10-22T17:50:58Z,,,https://d1qb2nb5cznatu.cloudfront.net/startups/i/886021-768d3156bf3b995cde3237a3aa06bbae-thumb_jpg.jpg?buster=1445541142,Agricultural Social Park,"{'intro': {'has': False, 'can': False}}"
883914,False,https://angel.co/saferway,blank,[],https://d1qb2nb5cznatu.cloudfront.net/startups/i/883914-bd134d68841bf927975248917a361df5-medium_jpg.jpg?buster=1445409637,http://www.saferway.io,,,,"[{'id': 1692, 'angellist_url': 'https://angel.co/san-francisco', 'display_name': 'San Francisco', 'name': 'san francisco', 'tag_type': 'LocationTag'}]",1,,Saferway Mobile,2015-10-24T11:26:13Z,True,[],"[{'id': 3, 'angellist_url': 'https://angel.co/mobile-2', 'display_name': 'Mobile', 'name': 'mobile', 'tag_type': 'MarketTag'}, {'id': 3092, 'angellist_url': 'https://angel.co/lifestyle', 'display_name': 'Lifestyle', 'name': 'lifestyle', 'tag_type': 'MarketTag'}, {'id': 9670, 'angellist_url': 'https://angel.co/public-safety', 'display_name': 'Public Safety', 'name': 'public safety', 'tag_type': 'MarketTag'}, {'id': 105365, 'angellist_url': 'https://angel.co/google-glass-3', 'display_name': 'Google Glass', 'name': 'google glass', 'tag_type': 'MarketTag'}]",,,0,2015-10-21T06:40:43Z,,,https://d1qb2nb5cznatu.cloudfront.net/startups/i/883914-bd134d68841bf927975248917a361df5-thumb_jpg.jpg?buster=1445409637,Better safety service with video,"{'intro': {'has': False, 'can': False}}"
887323,False,https://angel.co/sconsults,"Integrated Media Consultancy geared to Start up Ventures in Technology
Silicon Valley based",[],https://d1qb2nb5cznatu.cloudfront.net/startups/i/887323-cc57f87ee91b44cffbd9f6d48e1b3b25-medium_jpg.jpg?buster=1445633095,http://sconsults.co/,,,,"[{'id': 1693, 'angellist_url': 'https://angel.co/san-jose', 'display_name': 'San Jose', 'name': 'san jose', 'tag_type': 'LocationTag'}]",3,,sconsults,2015-10-23T20:45:00Z,False,"[{'id': 127570, 'angellist_url': 'https://angel.co/marketing-services', 'display_name': 'Marketing Services', 'name': 'Marketing Services', 'tag_type': 'CompanyTypeTag'}, {'id': 132149, 'angellist_url': 'https://angel.co/private-company-1', 'display_name': 'Private Company', 'name': 'private company', 'tag_type': 'CompanyTypeTag'}]","[{'id': 12, 'angellist_url': 'https://angel.co/enterprise-software', 'display_name': 'Enterprise Software', 'name': 'enterprise software', 'tag_type': 'MarketTag'}, {'id': 94, 'angellist_url': 'https://angel.co/mobile-commerce-1', 'display_name': 'Mobile Commerce', 'name': 'mobile commerce', 'tag_type': 'MarketTag'}, {'id': 171, 'angellist_url': 'https://angel.co/enterprise-security', 'display_name': 'Enterprise Security', 'name': 'enterprise security', 'tag_type': 'MarketTag'}]",,,3,2015-10-23T19:41:25Z,,,https://d1qb2nb5cznatu.cloudfront.net/startups/i/887323-cc57f87ee91b44cffbd9f6d48e1b3b25-thumb_jpg.jpg?buster=1445633095,integrated marketing development,"{'intro': {'has': False, 'can': False}}"
887190,False,https://angel.co/scoutoutapp,"We are a mobile app start-up that remedies the problem of repetitiously going to the same bar or pub week after week by creating a fun and engaging platform to explore the local brew dispensers in your area. Imagine you are traveling to a unfamiliar major city. You want to simply find a bar and get a pint, but you don't know where to go. Sure you could spend 15 minutes looking on Yelp for something, then conclude that no matter how you look at it you don't know which bars are good in the area. Eliminate the indecisiveness and have Scout Out choose for you. Explore tonight, find the hidden drinking gems around you.","[{'thumb': 'https://d2gn4xht817m0g.cloudfront.net/p/product_screenshots/images/thumb/000/607/380/607380-62bc9f4eb9752b5acafff9ea836b8a532352970d.jpg?1445892282', 'original': 'https://d2gn4xht817m0g.cloudfront.net/p/product_screenshots/images/original/000/607/380/607380-b5d9f9e163ee199bf299edff0063a2e0eb459921.png?1445892282'}, {'thumb': 'https://d2gn4xht817m0g.cloudfront.net/p/product_screenshots/images/thumb/000/607/382/607382-c504941cb9ef995cfe6324ebb3b9c1016d961abf.jpg?1445892304', 'original': 'https://d2gn4xht817m0g.cloudfront.net/p/product_screenshots/images/original/000/607/382/607382-d3c9e78dae181925e15fb475d61282b9cd9ee4ba.png?1445892304'}, {'thumb': 'https://d2gn4xht817m0g.cloudfront.net/p/product_screenshots/images/thumb/000/607/384/607384-e5f934dd9b1e501bedbc4e3d8b83614a183a7bce.jpg?1445892327', 'original': 'https://d2gn4xht817m0g.cloudfront.net/p/product_screenshots/images/original/000/607/384/607384-e8f8514da2c31e692af7aad513b88d9ad9436ce0.png?1445892327'}]",https://d1qb2nb5cznatu.cloudfront.net/startups/i/887190-6e1db5e0fcb90c7c1169b092d944a6e5-medium_jpg.jpg?buster=1446139106,http://scoutoutapp.com,,1-10,https://www.facebook.com/scoutoutapp/,"[{'id': 1705, 'angellist_url': 'https://angel.co/irvine', 'display_name': 'Irvine', 'name': 'irvine', 'tag_type': 'LocationTag'}]",3,,Scoutoutapp,2015-10-29T17:21:00Z,False,"[{'id': 141202, 'angellist_url': 'https://angel.co/mobile-app-2', 'display_name': 'Mobile App', 'name': 'Mobile App', 'tag_type': 'CompanyTypeTag'}]","[{'id': 3, 'angellist_url': 'https://angel.co/mobile-2', 'display_name': 'Mobile', 'name': 'mobile', 'tag_type': 'MarketTag'}, {'id': 490, 'angellist_url': 'https://angel.co/mobile-games-1', 'display_name': 'Mobile Games', 'name': 'mobile games', 'tag_type': 'MarketTag'}, {'id': 2812, 'angellist_url': 'https://angel.co/entertainment-industry', 'display_name': 'Entertainment Industry', 'name': 'entertainment industry', 'tag_type': 'MarketTag'}, {'id': 153044, 'angellist_url': 'https://angel.co/bars-2', 'display_name': 'Bars', 'name': 'Bars', 'tag_type': 'MarketTag'}]",https://twitter.com/scoutoutapp,,1,2015-10-23T17:42:17Z,,,https://d1qb2nb5cznatu.cloudfront.net/startups/i/887190-6e1db5e0fcb90c7c1169b092d944a6e5-thumb_jpg.jpg?buster=1446139106,Explore local bars in a fun adventurous way,"{'intro': {'has': False, 'can': False}}"
888156,False,https://angel.co/seateroo,"The Seateroo app offers a marketplace for airline seat swaps. Pre- or post-boarding, air travelers may check the Seateroo marketplace for current buy or sell orders, make an offer, post a new order, negotiate price, and make or receive electronic payment. With a limited inventory of preferred airline seats, Seateroo helps users swap for a preferred seat either prior to or after boarding. In addition, by enabling passengers to set the price for a seat swap, Seateroo helps other users monetize a seat preferred by another passenger. 

Seateroo will expand the inventory of preferred seats for passengers unable to purchase a preferred seat at the time of purchase. Seateroo will also expand the time window for passengers to acquire a preferred seat. Lastly, Seateroo will enable passengers to access preferred seats ""on-demand"" after boarding a flight, such as the desire to move away from a crying child or towards a friend or colleague. 

Seateroo is scheduled to launch in December 2015.","[{'thumb': 'https://d2gn4xht817m0g.cloudfront.net/p/product_screenshots/images/thumb/000/606/671/606671-0cc8ecab6ac1ea5508a532177e0996216e55652b.jpg?1445726663', 'original': 'https://d2gn4xht817m0g.cloudfront.net/p/product_screenshots/images/original/000/606/671/606671-60d225a4154b22d570a62679fa8d1f4593384e32.PNG?1445726663'}, {'thumb': 'https://d2gn4xht817m0g.cloudfront.net/p/product_screenshots/images/thumb/000/606/672/606672-dda0d9ae0fd83a4f2dd6f7aabcea3b99700276ca.jpg?1445726714', 'original': 'https://d2gn4xht817m0g.cloudfront.net/p/product_screenshots/images/original/000/606/672/606672-c798e4235e04896c7b4c97ecf6b8ab8e870088f4.PNG?1445726714'}, {'thumb': 'https://d2gn4xht817m0g.cloudfront.net/p/product_screenshots/images/thumb/000/606/673/606673-0191e4ad0716e4df53f9a65db9b69eedba73297a.jpg?1445726757', 'original': 'https://d2gn4xht817m0g.cloudfront.net/p/product_screenshots/images/original/000/606/673/606673-7ee40f3a64db86f9ffac29fb935a4e82caa453b2.PNG?1445726757'}, {'thumb': 'https://d2gn4xht817m0g.cloudfront.net/p/product_screenshots/images/thumb/000/606/674/606674-55ecf7aec42d77d8ac574b539cad80173258bb7a.jpg?1445726780', 'original': 'https://d2gn4xht817m0g.cloudfront.net/p/product_screenshots/images/original/000/606/674/606674-9291605669064af40270c3ea8fa5b662ab20bb00.PNG?1445726780'}, {'thumb': 'https://d2gn4xht817m0g.cloudfront.net/p/product_screenshots/images/thumb/000/606/675/606675-b68e9a234f85c3d2c7821ae103f625798f6db12a.jpg?1445726804', 'original': 'https://d2gn4xht817m0g.cloudfront.net/p/product_screenshots/images/original/000/606/675/606675-257baa9882fac6d70c35891ab98a954215c1e2b7.PNG?1445726804'}, {'thumb': 'https://d2gn4xht817m0g.cloudfront.net/p/product_screenshots/images/thumb/000/606/676/606676-b5c75699cb8e9bc1a8c60a4b1d118d0ad718a485.jpg?1445726833', 'original': 'https://d2gn4xht817m0g.cloudfront.net/p/product_screenshots/images/original/000/606/676/606676-5c08a7ced9030fd0e3996925b632cb5e8fae404e.PNG?1445726833'}, {'thumb': 'https://d2gn4xht817m0g.cloudfront.net/p/product_screenshots/images/thumb/000/606/677/606677-ccc3f28b8396de1b444427a7780e71532cd55cd6.jpg?1445726850', 'original': 'https://d2gn4xht817m0g.cloudfront.net/p/product_screenshots/images/original/000/606/677/606677-55e3a6060d61d16a046f4d0c3e12cbac186d1fad.PNG?1445726850'}]",https://d1qb2nb5cznatu.cloudfront.net/startups/i/888156-cdf1d9cd1d4edb3d7f1d828cd48ad6ad-medium_jpg.jpg?buster=1445726149,http://www.seateroo.com,,,,"[{'id': 1679, 'angellist_url': 'https://angel.co/san-diego', 'display_name': 'San Diego', 'name': 'san diego', 'tag_type': 'LocationTag'}]",5,,Seateroo,2015-10-24T22:48:01Z,False,[],"[{'id': 3, 'angellist_url': 'https://angel.co/mobile-2', 'display_name': 'Mobile', 'name': 'mobile', 'tag_type': 'MarketTag'}, {'id': 78, 'angellist_url': 'https://angel.co/online-travel', 'display_name': 'Online Travel', 'name': 'online travel', 'tag_type': 'MarketTag'}, {'id': 134, 'angellist_url': 'https://angel.co/peer-to-peer', 'display_name': 'Peer-to-Peer', 'name': 'peer-to-peer', 'tag_type': 'MarketTag'}, {'id': 836, 'angellist_url': 'https://angel.co/apps', 'display_name': 'Apps', 'name': 'apps', 'tag_type': 'MarketTag'}]",,,1,2015-10-24T22:35:54Z,,"{'message': 'https://youtu.be/ddDsojHYX2s', 'created_at': '2015-11-01T18:51:10Z', 'id': 200539}",https://d1qb2nb5cznatu.cloudfront.net/startups/i/888156-cdf1d9cd1d4edb3d7f1d828cd48ad6ad-thumb_jpg.jpg?buster=1445726149,StubHub for Airline Seat Swaps,"{'intro': {'has': False, 'can': False}}"
